08:26:14.018472 IP 10.1.1.1.54468 > 8.8.4.4.8844: UDP, length 1470
08:26:14.029699 IP 10.1.1.1.54468 > 8.8.4.4.8844: UDP, length 1470
08:26:14.040897 IP 10.1.1.1.54468 > 8.8.4.4.8844: UDP, length 1470
08:26:14.051992 IP 10.1.1.1.54468 > 8.8.4.4.8844: UDP, length 1470
08:26:14.063291 IP 10.1.1.1.54468 > 8.8.4.4.8844: UDP, length 1470
08:26:14.074534 IP 10.1.1.1.54468 > 8.8.4.4.8844: UDP, length 1470
08:26:14.085751 IP 10.1.1.1.54468 > 8.8.4.4.8844: UDP, length 1470
08:26:14.096870 IP 10.1.1.1.54468 > 8.8.4.4.8844: UDP, length 1470
08:26:14.108112 IP 10.1.1.1.54468 > 8.8.4.4.8844: UDP, length 1470
08:26:14.119407 IP 10.1.1.1.54468 > 8.8.4.4.8844: UDP, length 1470
08:26:14.130525 IP 10.1.1.1.54468 > 8.8.4.4.8844: UDP, length 1470
08:26:14.141839 IP 10.1.1.1.54468 > 8.8.4.4.8844: UDP, length 1470
08:26:14.153051 IP 10.1.1.1.54468 > 8.8.4.4.8844: UDP, length 1470
08:26:14.164132 IP 10.1.1.1.54468 > 8.8.4.4.8844: UDP, length 1470
08:26:14.175478 IP 10.1.1.1.54468 > 8.8.4.4.8844: UDP, length 1470
08:26:14.186695 IP 10.1.1.1.54468 > 8.8.4.4.8844: UDP, length 1470
08:26:14.197873 IP 10.1.1.1.54468 > 8.8.4.4.8844: UDP, length 1470
08:26:14.209102 IP 10.1.1.1.54468 > 8.8.4.4.8844: UDP, length 1470
08:26:14.220265 IP 10.1.1.1.54468 > 8.8.4.4.8844: UDP, length 1470
08:26:14.231433 IP 10.1.1.1.54468 > 8.8.4.4.8844: UDP, length 1470
08:26:14.242752 IP 10.1.1.1.54468 > 8.8.4.4.8844: UDP, length 1470
08:26:14.253972 IP 10.1.1.1.54468 > 8.8.4.4.8844: UDP, length 1470
08:26:14.265073 IP 10.1.1.1.54468 > 8.8.4.4.8844: UDP, length 1470
08:26:14.276337 IP 10.1.1.1.54468 > 8.8.4.4.8844: UDP, length 1470
08:26:14.287614 IP 10.1.1.1.54468 > 8.8.4.4.8844: UDP, length 1470
08:26:14.298818 IP 10.1.1.1.54468 > 8.8.4.4.8844: UDP, length 1470
08:26:14.310051 IP 10.1.1.1.54468 > 8.8.4.4.8844: UDP, length 1470
08:26:14.321272 IP 10.1.1.1.54468 > 8.8.4.4.8844: UDP, length 1470
08:26:14.332505 IP 10.1.1.1.54468 > 8.8.4.4.8844: UDP, length 1470
08:26:14.343682 IP 10.1.1.1.54468 > 8.8.4.4.8844: UDP, length 1470
08:26:14.354910 IP 10.1.1.1.54468 > 8.8.4.4.8844: UDP, length 1470
08:26:14.366113 IP 10.1.1.1.54468 > 8.8.4.4.8844: UDP, length 1470
08:26:14.377331 IP 10.1.1.1.54468 > 8.8.4.4.8844: UDP, length 1470
08:26:14.388566 IP 10.1.1.1.54468 > 8.8.4.4.8844: UDP, length 1470
08:26:14.399758 IP 10.1.1.1.54468 > 8.8.4.4.8844: UDP, length 1470
08:26:14.410989 IP 10.1.1.1.54468 > 8.8.4.4.8844: UDP, length 1470
08:26:14.422185 IP 10.1.1.1.54468 > 8.8.4.4.8844: UDP, length 1470
08:26:14.433300 IP 10.1.1.1.54468 > 8.8.4.4.8844: UDP, length 1470
08:26:14.444542 IP 10.1.1.1.54468 > 8.8.4.4.8844: UDP, length 1470
08:26:14.455743 IP 10.1.1.1.54468 > 8.8.4.4.8844: UDP, length 1470
08:26:14.466988 IP 10.1.1.1.54468 > 8.8.4.4.8844: UDP, length 1470
08:26:14.478160 IP 10.1.1.1.54468 > 8.8.4.4.8844: UDP, length 1470
08:26:14.489517 IP 10.1.1.1.54468 > 8.8.4.4.8844: UDP, length 1470
08:26:14.500587 IP 10.1.1.1.54468 > 8.8.4.4.8844: UDP, length 1470
08:26:14.511813 IP 10.1.1.1.54468 > 8.8.4.4.8844: UDP, length 1470
08:26:14.523149 IP 10.1.1.1.54468 > 8.8.4.4.8844: UDP, length 1470
08:26:14.534291 IP 10.1.1.1.54468 > 8.8.4.4.8844: UDP, length 1470
08:26:14.545478 IP 10.1.1.1.54468 > 8.8.4.4.8844: UDP, length 1470
08:26:14.556822 IP 10.1.1.1.54468 > 8.8.4.4.8844: UDP, length 1470
08:26:14.567966 IP 10.1.1.1.54468 > 8.8.4.4.8844: UDP, length 1470
08:26:14.579256 IP 10.1.1.1.54468 > 8.8.4.4.8844: UDP, length 1470
08:26:14.590481 IP 10.1.1.1.54468 > 8.8.4.4.8844: UDP, length 1470
08:26:14.601616 IP 10.1.1.1.54468 > 8.8.4.4.8844: UDP, length 1470
08:26:14.612789 IP 10.1.1.1.54468 > 8.8.4.4.8844: UDP, length 1470
08:26:14.623993 IP 10.1.1.1.54468 > 8.8.4.4.8844: UDP, length 1470
08:26:14.635207 IP 10.1.1.1.54468 > 8.8.4.4.8844: UDP, length 1470
08:26:14.646533 IP 10.1.1.1.54468 > 8.8.4.4.8844: UDP, length 1470
08:26:14.657768 IP 10.1.1.1.54468 > 8.8.4.4.8844: UDP, length 1470
08:26:14.668906 IP 10.1.1.1.54468 > 8.8.4.4.8844: UDP, length 1470
08:26:14.680113 IP 10.1.1.1.54468 > 8.8.4.4.8844: UDP, length 1470
08:26:14.691425 IP 10.1.1.1.54468 > 8.8.4.4.8844: UDP, length 1470
08:26:14.702665 IP 10.1.1.1.54468 > 8.8.4.4.8844: UDP, length 1470
08:26:14.713825 IP 10.1.1.1.54468 > 8.8.4.4.8844: UDP, length 1470
08:26:14.725011 IP 10.1.1.1.54468 > 8.8.4.4.8844: UDP, length 1470
08:26:14.736293 IP 10.1.1.1.54468 > 8.8.4.4.8844: UDP, length 1470
08:26:14.747503 IP 10.1.1.1.54468 > 8.8.4.4.8844: UDP, length 1470
08:26:14.758585 IP 10.1.1.1.54468 > 8.8.4.4.8844: UDP, length 1470
08:26:14.769901 IP 10.1.1.1.54468 > 8.8.4.4.8844: UDP, length 1470
08:26:14.781136 IP 10.1.1.1.54468 > 8.8.4.4.8844: UDP, length 1470
08:26:14.792270 IP 10.1.1.1.54468 > 8.8.4.4.8844: UDP, length 1470
08:26:14.803651 IP 10.1.1.1.54468 > 8.8.4.4.8844: UDP, length 1470
08:26:14.814854 IP 10.1.1.1.54468 > 8.8.4.4.8844: UDP, length 1470
08:26:14.826025 IP 10.1.1.1.54468 > 8.8.4.4.8844: UDP, length 1470
08:26:14.837247 IP 10.1.1.1.54468 > 8.8.4.4.8844: UDP, length 1470
08:26:14.848377 IP 10.1.1.1.54468 > 8.8.4.4.8844: UDP, length 1470
08:26:14.859687 IP 10.1.1.1.54468 > 8.8.4.4.8844: UDP, length 1470
08:26:14.870890 IP 10.1.1.1.54468 > 8.8.4.4.8844: UDP, length 1470
08:26:14.882032 IP 10.1.1.1.54468 > 8.8.4.4.8844: UDP, length 1470
08:26:14.893311 IP 10.1.1.1.54468 > 8.8.4.4.8844: UDP, length 1470
08:26:14.904620 IP 10.1.1.1.54468 > 8.8.4.4.8844: UDP, length 1470
08:26:14.915809 IP 10.1.1.1.54468 > 8.8.4.4.8844: UDP, length 1470
08:26:14.926942 IP 10.1.1.1.54468 > 8.8.4.4.8844: UDP, length 1470
08:26:14.938178 IP 10.1.1.1.54468 > 8.8.4.4.8844: UDP, length 1470
08:26:14.949385 IP 10.1.1.1.54468 > 8.8.4.4.8844: UDP, length 1470
08:26:14.960626 IP 10.1.1.1.54468 > 8.8.4.4.8844: UDP, length 1470
08:26:14.971816 IP 10.1.1.1.54468 > 8.8.4.4.8844: UDP, length 1470
08:26:14.983080 IP 10.1.1.1.54468 > 8.8.4.4.8844: UDP, length 1470
08:26:14.994269 IP 10.1.1.1.54468 > 8.8.4.4.8844: UDP, length 1470
08:26:15.005503 IP 10.1.1.1.54468 > 8.8.4.4.8844: UDP, length 1470
08:26:15.016739 IP 10.1.1.1.54468 > 8.8.4.4.8844: UDP, length 1470
08:26:15.027864 IP 10.1.1.1.54468 > 8.8.4.4.8844: UDP, length 1470
08:26:15.039204 IP 10.1.1.1.54468 > 8.8.4.4.8844: UDP, length 1470
08:26:15.050399 IP 10.1.1.1.54468 > 8.8.4.4.8844: UDP, length 1470
08:26:15.061623 IP 10.1.1.1.54468 > 8.8.4.4.8844: UDP, length 1470
08:26:15.072859 IP 10.1.1.1.54468 > 8.8.4.4.8844: UDP, length 1470
08:26:15.083899 IP 10.1.1.1.54468 > 8.8.4.4.8844: UDP, length 1470
08:26:15.095177 IP 10.1.1.1.54468 > 8.8.4.4.8844: UDP, length 1470
08:26:15.106476 IP 10.1.1.1.54468 > 8.8.4.4.8844: UDP, length 1470
08:26:15.117628 IP 10.1.1.1.54468 > 8.8.4.4.8844: UDP, length 1470
08:26:15.367792 IP 10.1.1.1.54468 > 8.8.4.4.8844: UDP, length 1470
08:26:15.618149 IP 10.1.1.1.54468 > 8.8.4.4.8844: UDP, length 1470
08:26:15.868517 IP 10.1.1.1.54468 > 8.8.4.4.8844: UDP, length 1470
08:26:16.118970 IP 10.1.1.1.54468 > 8.8.4.4.8844: UDP, length 1470
^C
899 packets captured
899 packets received by filter
0 packets dropped by kernel
root@raul-Dell-G15-5520:/home/raul/documents/workspace/router-filtering-mininet
# [H[Jroot@raul-Dell-G15-5520:/home/raul/documents/workspace/router-filtering-mininet
# tcpdump
tcpdump: verbose output suppressed, use -v or -vv for full protocol decode
listening on h1-eth0, link-type EN10MB (Ethernet), capture size 262144 bytes
08:26:43.190972 IP 10.1.1.1.40798 > 8.8.8.8.8888: Flags [S], seq 783267091, win 42340, options [mss 1460,sackOK,TS val 3360084098 ecr 0,nop,wscale 9], length 0
08:26:43.364967 ARP, Request who-has 10.1.1.1 tell 10.1.1.254, length 28
08:26:43.364985 ARP, Reply 10.1.1.1 is-at 7e:6f:42:cf:5c:a0 (oui Unknown), length 28
08:26:43.420311 IP 8.8.8.8.8888 > 10.1.1.1.40798: Flags [S.], seq 2228278075, ack 783267092, win 43440, options [mss 1460,sackOK,TS val 1734613285 ecr 3360084098,nop,wscale 9], length 0
08:26:43.420355 IP 10.1.1.1.40798 > 8.8.8.8.8888: Flags [.], ack 1, win 83, options [nop,nop,TS val 3360084327 ecr 1734613285], length 0
08:26:43.420557 IP 10.1.1.1.40798 > 8.8.8.8.8888: Flags [P.], seq 1:2897, ack 1, win 83, options [nop,nop,TS val 3360084327 ecr 1734613285], length 2896
08:26:43.420575 IP 10.1.1.1.40798 > 8.8.8.8.8888: Flags [P.], seq 2897:5793, ack 1, win 83, options [nop,nop,TS val 3360084327 ecr 1734613285], length 2896
08:26:43.420579 IP 10.1.1.1.40798 > 8.8.8.8.8888: Flags [P.], seq 5793:8689, ack 1, win 83, options [nop,nop,TS val 3360084327 ecr 1734613285], length 2896
08:26:43.420582 IP 10.1.1.1.40798 > 8.8.8.8.8888: Flags [P.], seq 8689:11585, ack 1, win 83, options [nop,nop,TS val 3360084327 ecr 1734613285], length 2896
08:26:43.420585 IP 10.1.1.1.40798 > 8.8.8.8.8888: Flags [P.], seq 11585:14481, ack 1, win 83, options [nop,nop,TS val 3360084327 ecr 1734613285], length 2896
08:26:43.907669 IP 10.1.1.1.40798 > 8.8.8.8.8888: Flags [.], seq 14481:15929, ack 1, win 83, options [nop,nop,TS val 3360084815 ecr 1734613285], length 1448
08:26:44.611863 IP 10.1.1.1.40798 > 8.8.8.8.8888: Flags [.], seq 1:1449, ack 1, win 83, options [nop,nop,TS val 3360085519 ecr 1734613285], length 1448
08:26:46.019746 IP 10.1.1.1.40798 > 8.8.8.8.8888: Flags [.], seq 1:1449, ack 1, win 83, options [nop,nop,TS val 3360086927 ecr 1734613285], length 1448
^C
13 packets captured
13 packets received by filter
0 packets dropped by kernel
root@raul-Dell-G15-5520:/home/raul/documents/workspace/router-filtering-mininet
# [H[Jroot@raul-Dell-G15-5520:/home/raul/documents/workspace/router-filtering-mininet
# tcpdump
tcpdump: verbose output suppressed, use -v or -vv for full protocol decode
listening on h1-eth0, link-type EN10MB (Ethernet), capture size 262144 bytes
08:27:45.068137 IP 10.1.1.1.41027 > 8.8.4.4.8844: UDP, length 1470
08:27:45.079510 IP 10.1.1.1.41027 > 8.8.4.4.8844: UDP, length 1470
08:27:45.090731 IP 10.1.1.1.41027 > 8.8.4.4.8844: UDP, length 1470
08:27:45.102202 IP 10.1.1.1.41027 > 8.8.4.4.8844: UDP, length 1470
08:27:45.113168 IP 10.1.1.1.41027 > 8.8.4.4.8844: UDP, length 1470
08:27:45.124367 IP 10.1.1.1.41027 > 8.8.4.4.8844: UDP, length 1470
08:27:45.135717 IP 10.1.1.1.41027 > 8.8.4.4.8844: UDP, length 1470
08:27:45.146819 IP 10.1.1.1.41027 > 8.8.4.4.8844: UDP, length 1470
08:27:45.158074 IP 10.1.1.1.41027 > 8.8.4.4.8844: UDP, length 1470
08:27:45.169342 IP 10.1.1.1.41027 > 8.8.4.4.8844: UDP, length 1470
08:27:45.180324 IP 10.1.1.1.41027 > 8.8.4.4.8844: UDP, length 1470
08:27:45.191694 IP 10.1.1.1.41027 > 8.8.4.4.8844: UDP, length 1470
08:27:45.203010 IP 10.1.1.1.41027 > 8.8.4.4.8844: UDP, length 1470
08:27:45.213987 IP 10.1.1.1.41027 > 8.8.4.4.8844: UDP, length 1470
08:27:45.225320 IP 10.1.1.1.41027 > 8.8.4.4.8844: UDP, length 1470
08:27:45.236517 IP 10.1.1.1.41027 > 8.8.4.4.8844: UDP, length 1470
08:27:45.247739 IP 10.1.1.1.41027 > 8.8.4.4.8844: UDP, length 1470
08:27:45.258954 IP 10.1.1.1.41027 > 8.8.4.4.8844: UDP, length 1470
08:27:45.270174 IP 10.1.1.1.41027 > 8.8.4.4.8844: UDP, length 1470
08:27:45.281277 IP 10.1.1.1.41027 > 8.8.4.4.8844: UDP, length 1470
08:27:45.292629 IP 10.1.1.1.41027 > 8.8.4.4.8844: UDP, length 1470
08:27:45.303761 IP 10.1.1.1.41027 > 8.8.4.4.8844: UDP, length 1470
08:27:45.315027 IP 10.1.1.1.41027 > 8.8.4.4.8844: UDP, length 1470
08:27:45.326225 IP 10.1.1.1.41027 > 8.8.4.4.8844: UDP, length 1470
08:27:45.337450 IP 10.1.1.1.41027 > 8.8.4.4.8844: UDP, length 1470
08:27:45.348695 IP 10.1.1.1.41027 > 8.8.4.4.8844: UDP, length 1470
08:27:45.359800 IP 10.1.1.1.41027 > 8.8.4.4.8844: UDP, length 1470
08:27:45.371120 IP 10.1.1.1.41027 > 8.8.4.4.8844: UDP, length 1470
08:27:45.382301 IP 10.1.1.1.41027 > 8.8.4.4.8844: UDP, length 1470
08:27:45.393488 IP 10.1.1.1.41027 > 8.8.4.4.8844: UDP, length 1470
08:27:45.404599 IP 10.1.1.1.41027 > 8.8.4.4.8844: UDP, length 1470
08:27:45.415834 IP 10.1.1.1.41027 > 8.8.4.4.8844: UDP, length 1470
08:27:45.427174 IP 10.1.1.1.41027 > 8.8.4.4.8844: UDP, length 1470
08:27:45.438417 IP 10.1.1.1.41027 > 8.8.4.4.8844: UDP, length 1470
08:27:45.449581 IP 10.1.1.1.41027 > 8.8.4.4.8844: UDP, length 1470
08:27:45.460682 IP 10.1.1.1.41027 > 8.8.4.4.8844: UDP, length 1470
08:27:45.471900 IP 10.1.1.1.41027 > 8.8.4.4.8844: UDP, length 1470
08:27:45.483178 IP 10.1.1.1.41027 > 8.8.4.4.8844: UDP, length 1470
08:27:45.494362 IP 10.1.1.1.41027 > 8.8.4.4.8844: UDP, length 1470
08:27:45.505623 IP 10.1.1.1.41027 > 8.8.4.4.8844: UDP, length 1470
08:27:45.516801 IP 10.1.1.1.41027 > 8.8.4.4.8844: UDP, length 1470
08:27:45.528041 IP 10.1.1.1.41027 > 8.8.4.4.8844: UDP, length 1470
08:27:45.539359 IP 10.1.1.1.41027 > 8.8.4.4.8844: UDP, length 1470
08:27:45.550523 IP 10.1.1.1.41027 > 8.8.4.4.8844: UDP, length 1470
08:27:45.561900 IP 10.1.1.1.41027 > 8.8.4.4.8844: UDP, length 1470
08:27:45.572988 IP 10.1.1.1.41027 > 8.8.4.4.8844: UDP, length 1470
08:27:45.584152 IP 10.1.1.1.41027 > 8.8.4.4.8844: UDP, length 1470
08:27:45.595355 IP 10.1.1.1.41027 > 8.8.4.4.8844: UDP, length 1470
08:27:45.606606 IP 10.1.1.1.41027 > 8.8.4.4.8844: UDP, length 1470
08:27:45.617809 IP 10.1.1.1.41027 > 8.8.4.4.8844: UDP, length 1470
08:27:45.628989 IP 10.1.1.1.41027 > 8.8.4.4.8844: UDP, length 1470
08:27:45.640162 IP 10.1.1.1.41027 > 8.8.4.4.8844: UDP, length 1470
08:27:45.651381 IP 10.1.1.1.41027 > 8.8.4.4.8844: UDP, length 1470
08:27:45.662628 IP 10.1.1.1.41027 > 8.8.4.4.8844: UDP, length 1470
08:27:45.673856 IP 10.1.1.1.41027 > 8.8.4.4.8844: UDP, length 1470
08:27:45.685017 IP 10.1.1.1.41027 > 8.8.4.4.8844: UDP, length 1470
08:27:45.696249 IP 10.1.1.1.41027 > 8.8.4.4.8844: UDP, length 1470
08:27:45.707553 IP 10.1.1.1.41027 > 8.8.4.4.8844: UDP, length 1470
08:27:45.718751 IP 10.1.1.1.41027 > 8.8.4.4.8844: UDP, length 1470
08:27:45.729887 IP 10.1.1.1.41027 > 8.8.4.4.8844: UDP, length 1470
08:27:45.741262 IP 10.1.1.1.41027 > 8.8.4.4.8844: UDP, length 1470
08:27:45.752332 IP 10.1.1.1.41027 > 8.8.4.4.8844: UDP, length 1470
08:27:45.763599 IP 10.1.1.1.41027 > 8.8.4.4.8844: UDP, length 1470
08:27:45.774805 IP 10.1.1.1.41027 > 8.8.4.4.8844: UDP, length 1470
08:27:45.786037 IP 10.1.1.1.41027 > 8.8.4.4.8844: UDP, length 1470
08:27:45.797259 IP 10.1.1.1.41027 > 8.8.4.4.8844: UDP, length 1470
08:27:45.808394 IP 10.1.1.1.41027 > 8.8.4.4.8844: UDP, length 1470
08:27:45.819698 IP 10.1.1.1.41027 > 8.8.4.4.8844: UDP, length 1470
08:27:45.830828 IP 10.1.1.1.41027 > 8.8.4.4.8844: UDP, length 1470
08:27:45.842124 IP 10.1.1.1.41027 > 8.8.4.4.8844: UDP, length 1470
08:27:45.853213 IP 10.1.1.1.41027 > 8.8.4.4.8844: UDP, length 1470
08:27:45.864492 IP 10.1.1.1.41027 > 8.8.4.4.8844: UDP, length 1470
08:27:45.875732 IP 10.1.1.1.41027 > 8.8.4.4.8844: UDP, length 1470
08:27:45.886845 IP 10.1.1.1.41027 > 8.8.4.4.8844: UDP, length 1470
08:27:45.898185 IP 10.1.1.1.41027 > 8.8.4.4.8844: UDP, length 1470
08:27:45.909386 IP 10.1.1.1.41027 > 8.8.4.4.8844: UDP, length 1470
08:27:45.920556 IP 10.1.1.1.41027 > 8.8.4.4.8844: UDP, length 1470
08:27:45.931801 IP 10.1.1.1.41027 > 8.8.4.4.8844: UDP, length 1470
08:27:45.943083 IP 10.1.1.1.41027 > 8.8.4.4.8844: UDP, length 1470
08:27:45.954163 IP 10.1.1.1.41027 > 8.8.4.4.8844: UDP, length 1470
08:27:45.965496 IP 10.1.1.1.41027 > 8.8.4.4.8844: UDP, length 1470
08:27:45.976713 IP 10.1.1.1.41027 > 8.8.4.4.8844: UDP, length 1470
08:27:45.987817 IP 10.1.1.1.41027 > 8.8.4.4.8844: UDP, length 1470
08:27:45.999097 IP 10.1.1.1.41027 > 8.8.4.4.8844: UDP, length 1470
08:27:46.010237 IP 10.1.1.1.41027 > 8.8.4.4.8844: UDP, length 1470
08:27:46.021526 IP 10.1.1.1.41027 > 8.8.4.4.8844: UDP, length 1470
08:27:46.032781 IP 10.1.1.1.41027 > 8.8.4.4.8844: UDP, length 1470
08:27:46.043865 IP 10.1.1.1.41027 > 8.8.4.4.8844: UDP, length 1470
08:27:46.055173 IP 10.1.1.1.41027 > 8.8.4.4.8844: UDP, length 1470
08:27:46.066423 IP 10.1.1.1.41027 > 8.8.4.4.8844: UDP, length 1470
08:27:46.077626 IP 10.1.1.1.41027 > 8.8.4.4.8844: UDP, length 1470
08:27:46.088771 IP 10.1.1.1.41027 > 8.8.4.4.8844: UDP, length 1470
08:27:46.100049 IP 10.1.1.1.41027 > 8.8.4.4.8844: UDP, length 1470
08:27:46.111295 IP 10.1.1.1.41027 > 8.8.4.4.8844: UDP, length 1470
08:27:46.122400 IP 10.1.1.1.41027 > 8.8.4.4.8844: UDP, length 1470
08:27:46.133653 IP 10.1.1.1.41027 > 8.8.4.4.8844: UDP, length 1470
08:27:46.144914 IP 10.1.1.1.41027 > 8.8.4.4.8844: UDP, length 1470
08:27:46.156053 IP 10.1.1.1.41027 > 8.8.4.4.8844: UDP, length 1470
08:27:46.167370 IP 10.1.1.1.41027 > 8.8.4.4.8844: UDP, length 1470
08:27:46.178582 IP 10.1.1.1.41027 > 8.8.4.4.8844: UDP, length 1470
08:27:46.189697 IP 10.1.1.1.41027 > 8.8.4.4.8844: UDP, length 1470
08:27:46.201066 IP 10.1.1.1.41027 > 8.8.4.4.8844: UDP, length 1470
08:27:46.212142 IP 10.1.1.1.41027 > 8.8.4.4.8844: UDP, length 1470
08:27:46.223371 IP 10.1.1.1.41027 > 8.8.4.4.8844: UDP, length 1470
08:27:46.234749 IP 10.1.1.1.41027 > 8.8.4.4.8844: UDP, length 1470
08:27:46.245851 IP 10.1.1.1.41027 > 8.8.4.4.8844: UDP, length 1470
08:27:46.256993 IP 10.1.1.1.41027 > 8.8.4.4.8844: UDP, length 1470
08:27:46.268303 IP 10.1.1.1.41027 > 8.8.4.4.8844: UDP, length 1470
08:27:46.279526 IP 10.1.1.1.41027 > 8.8.4.4.8844: UDP, length 1470
08:27:46.290696 IP 10.1.1.1.41027 > 8.8.4.4.8844: UDP, length 1470
08:27:46.301991 IP 10.1.1.1.41027 > 8.8.4.4.8844: UDP, length 1470
08:27:46.313166 IP 10.1.1.1.41027 > 8.8.4.4.8844: UDP, length 1470
08:27:46.324238 IP 10.1.1.1.41027 > 8.8.4.4.8844: UDP, length 1470
08:27:46.335626 IP 10.1.1.1.41027 > 8.8.4.4.8844: UDP, length 1470
08:27:46.346776 IP 10.1.1.1.41027 > 8.8.4.4.8844: UDP, length 1470
08:27:46.357891 IP 10.1.1.1.41027 > 8.8.4.4.8844: UDP, length 1470
08:27:46.369235 IP 10.1.1.1.41027 > 8.8.4.4.8844: UDP, length 1470
08:27:46.380329 IP 10.1.1.1.41027 > 8.8.4.4.8844: UDP, length 1470
08:27:46.391542 IP 10.1.1.1.41027 > 8.8.4.4.8844: UDP, length 1470
08:27:46.402860 IP 10.1.1.1.41027 > 8.8.4.4.8844: UDP, length 1470
08:27:46.413980 IP 10.1.1.1.41027 > 8.8.4.4.8844: UDP, length 1470
08:27:46.425219 IP 10.1.1.1.41027 > 8.8.4.4.8844: UDP, length 1470
08:27:46.436412 IP 10.1.1.1.41027 > 8.8.4.4.8844: UDP, length 1470
08:27:46.447605 IP 10.1.1.1.41027 > 8.8.4.4.8844: UDP, length 1470
08:27:46.458864 IP 10.1.1.1.41027 > 8.8.4.4.8844: UDP, length 1470
08:27:46.470066 IP 10.1.1.1.41027 > 8.8.4.4.8844: UDP, length 1470
08:27:46.481277 IP 10.1.1.1.41027 > 8.8.4.4.8844: UDP, length 1470
08:27:46.492504 IP 10.1.1.1.41027 > 8.8.4.4.8844: UDP, length 1470
08:27:46.503769 IP 10.1.1.1.41027 > 8.8.4.4.8844: UDP, length 1470
08:27:46.514977 IP 10.1.1.1.41027 > 8.8.4.4.8844: UDP, length 1470
08:27:46.526123 IP 10.1.1.1.41027 > 8.8.4.4.8844: UDP, length 1470
08:27:46.537474 IP 10.1.1.1.41027 > 8.8.4.4.8844: UDP, length 1470
08:27:46.548662 IP 10.1.1.1.41027 > 8.8.4.4.8844: UDP, length 1470
08:27:46.559767 IP 10.1.1.1.41027 > 8.8.4.4.8844: UDP, length 1470
08:27:46.571107 IP 10.1.1.1.41027 > 8.8.4.4.8844: UDP, length 1470
08:27:46.582350 IP 10.1.1.1.41027 > 8.8.4.4.8844: UDP, length 1470
08:27:46.593432 IP 10.1.1.1.41027 > 8.8.4.4.8844: UDP, length 1470
08:27:46.604789 IP 10.1.1.1.41027 > 8.8.4.4.8844: UDP, length 1470
08:27:46.615852 IP 10.1.1.1.41027 > 8.8.4.4.8844: UDP, length 1470
08:27:46.627057 IP 10.1.1.1.41027 > 8.8.4.4.8844: UDP, length 1470
08:27:46.638395 IP 10.1.1.1.41027 > 8.8.4.4.8844: UDP, length 1470
08:27:46.649496 IP 10.1.1.1.41027 > 8.8.4.4.8844: UDP, length 1470
08:27:46.660822 IP 10.1.1.1.41027 > 8.8.4.4.8844: UDP, length 1470
08:27:46.671930 IP 10.1.1.1.41027 > 8.8.4.4.8844: UDP, length 1470
08:27:46.683151 IP 10.1.1.1.41027 > 8.8.4.4.8844: UDP, length 1470
08:27:46.694358 IP 10.1.1.1.41027 > 8.8.4.4.8844: UDP, length 1470
08:27:46.705693 IP 10.1.1.1.41027 > 8.8.4.4.8844: UDP, length 1470
08:27:46.716806 IP 10.1.1.1.41027 > 8.8.4.4.8844: UDP, length 1470
08:27:46.728001 IP 10.1.1.1.41027 > 8.8.4.4.8844: UDP, length 1470
08:27:46.739351 IP 10.1.1.1.41027 > 8.8.4.4.8844: UDP, length 1470
08:27:46.750471 IP 10.1.1.1.41027 > 8.8.4.4.8844: UDP, length 1470
08:27:46.761686 IP 10.1.1.1.41027 > 8.8.4.4.8844: UDP, length 1470
08:27:46.773016 IP 10.1.1.1.41027 > 8.8.4.4.8844: UDP, length 1470
08:27:46.784123 IP 10.1.1.1.41027 > 8.8.4.4.8844: UDP, length 1470
08:27:46.795329 IP 10.1.1.1.41027 > 8.8.4.4.8844: UDP, length 1470
08:27:46.806689 IP 10.1.1.1.41027 > 8.8.4.4.8844: UDP, length 1470
08:27:46.817864 IP 10.1.1.1.41027 > 8.8.4.4.8844: UDP, length 1470
08:27:46.829046 IP 10.1.1.1.41027 > 8.8.4.4.8844: UDP, length 1470
08:27:46.840204 IP 10.1.1.1.41027 > 8.8.4.4.8844: UDP, length 1470
08:27:46.851464 IP 10.1.1.1.41027 > 8.8.4.4.8844: UDP, length 1470
08:27:46.862674 IP 10.1.1.1.41027 > 8.8.4.4.8844: UDP, length 1470
08:27:46.873926 IP 10.1.1.1.41027 > 8.8.4.4.8844: UDP, length 1470
08:27:46.885126 IP 10.1.1.1.41027 > 8.8.4.4.8844: UDP, length 1470
08:27:46.896245 IP 10.1.1.1.41027 > 8.8.4.4.8844: UDP, length 1470
08:27:46.907598 IP 10.1.1.1.41027 > 8.8.4.4.8844: UDP, length 1470
08:27:46.918781 IP 10.1.1.1.41027 > 8.8.4.4.8844: UDP, length 1470
08:27:46.929874 IP 10.1.1.1.41027 > 8.8.4.4.8844: UDP, length 1470
08:27:46.941223 IP 10.1.1.1.41027 > 8.8.4.4.8844: UDP, length 1470
08:27:46.952411 IP 10.1.1.1.41027 > 8.8.4.4.8844: UDP, length 1470
08:27:46.963517 IP 10.1.1.1.41027 > 8.8.4.4.8844: UDP, length 1470
08:27:46.974858 IP 10.1.1.1.41027 > 8.8.4.4.8844: UDP, length 1470
08:27:46.986086 IP 10.1.1.1.41027 > 8.8.4.4.8844: UDP, length 1470
08:27:46.997268 IP 10.1.1.1.41027 > 8.8.4.4.8844: UDP, length 1470
08:27:47.008415 IP 10.1.1.1.41027 > 8.8.4.4.8844: UDP, length 1470
08:27:47.019582 IP 10.1.1.1.41027 > 8.8.4.4.8844: UDP, length 1470
08:27:47.030906 IP 10.1.1.1.41027 > 8.8.4.4.8844: UDP, length 1470
08:27:47.042141 IP 10.1.1.1.41027 > 8.8.4.4.8844: UDP, length 1470
08:27:47.053242 IP 10.1.1.1.41027 > 8.8.4.4.8844: UDP, length 1470
08:27:47.064495 IP 10.1.1.1.41027 > 8.8.4.4.8844: UDP, length 1470
08:27:47.075746 IP 10.1.1.1.41027 > 8.8.4.4.8844: UDP, length 1470
08:27:47.087025 IP 10.1.1.1.41027 > 8.8.4.4.8844: UDP, length 1470
08:27:47.098110 IP 10.1.1.1.41027 > 8.8.4.4.8844: UDP, length 1470
08:27:47.109458 IP 10.1.1.1.41027 > 8.8.4.4.8844: UDP, length 1470
08:27:47.120679 IP 10.1.1.1.41027 > 8.8.4.4.8844: UDP, length 1470
08:27:47.131749 IP 10.1.1.1.41027 > 8.8.4.4.8844: UDP, length 1470
08:27:47.143001 IP 10.1.1.1.41027 > 8.8.4.4.8844: UDP, length 1470
08:27:47.154259 IP 10.1.1.1.41027 > 8.8.4.4.8844: UDP, length 1470
08:27:47.165630 IP 10.1.1.1.41027 > 8.8.4.4.8844: UDP, length 1470
08:27:47.176774 IP 10.1.1.1.41027 > 8.8.4.4.8844: UDP, length 1470
08:27:47.187957 IP 10.1.1.1.41027 > 8.8.4.4.8844: UDP, length 1470
08:27:47.199235 IP 10.1.1.1.41027 > 8.8.4.4.8844: UDP, length 1470
08:27:47.210389 IP 10.1.1.1.41027 > 8.8.4.4.8844: UDP, length 1470
08:27:47.221614 IP 10.1.1.1.41027 > 8.8.4.4.8844: UDP, length 1470
08:27:47.232838 IP 10.1.1.1.41027 > 8.8.4.4.8844: UDP, length 1470
08:27:47.243908 IP 10.1.1.1.41027 > 8.8.4.4.8844: UDP, length 1470
08:27:47.255182 IP 10.1.1.1.41027 > 8.8.4.4.8844: UDP, length 1470
08:27:47.266504 IP 10.1.1.1.41027 > 8.8.4.4.8844: UDP, length 1470
08:27:47.277722 IP 10.1.1.1.41027 > 8.8.4.4.8844: UDP, length 1470
08:27:47.288826 IP 10.1.1.1.41027 > 8.8.4.4.8844: UDP, length 1470
08:27:47.300065 IP 10.1.1.1.41027 > 8.8.4.4.8844: UDP, length 1470
08:27:47.311401 IP 10.1.1.1.41027 > 8.8.4.4.8844: UDP, length 1470
08:27:47.322537 IP 10.1.1.1.41027 > 8.8.4.4.8844: UDP, length 1470
08:27:47.333784 IP 10.1.1.1.41027 > 8.8.4.4.8844: UDP, length 1470
08:27:47.345086 IP 10.1.1.1.41027 > 8.8.4.4.8844: UDP, length 1470
08:27:47.356225 IP 10.1.1.1.41027 > 8.8.4.4.8844: UDP, length 1470
08:27:47.367392 IP 10.1.1.1.41027 > 8.8.4.4.8844: UDP, length 1470
08:27:47.378614 IP 10.1.1.1.41027 > 8.8.4.4.8844: UDP, length 1470
08:27:47.389811 IP 10.1.1.1.41027 > 8.8.4.4.8844: UDP, length 1470
08:27:47.401040 IP 10.1.1.1.41027 > 8.8.4.4.8844: UDP, length 1470
08:27:47.412159 IP 10.1.1.1.41027 > 8.8.4.4.8844: UDP, length 1470
08:27:47.423354 IP 10.1.1.1.41027 > 8.8.4.4.8844: UDP, length 1470
08:27:47.434675 IP 10.1.1.1.41027 > 8.8.4.4.8844: UDP, length 1470
08:27:47.445900 IP 10.1.1.1.41027 > 8.8.4.4.8844: UDP, length 1470
08:27:47.457047 IP 10.1.1.1.41027 > 8.8.4.4.8844: UDP, length 1470
08:27:47.468318 IP 10.1.1.1.41027 > 8.8.4.4.8844: UDP, length 1470
08:27:47.479474 IP 10.1.1.1.41027 > 8.8.4.4.8844: UDP, length 1470
08:27:47.490693 IP 10.1.1.1.41027 > 8.8.4.4.8844: UDP, length 1470
08:27:47.501872 IP 10.1.1.1.41027 > 8.8.4.4.8844: UDP, length 1470
08:27:47.513176 IP 10.1.1.1.41027 > 8.8.4.4.8844: UDP, length 1470
08:27:47.524298 IP 10.1.1.1.41027 > 8.8.4.4.8844: UDP, length 1470
08:27:47.535574 IP 10.1.1.1.41027 > 8.8.4.4.8844: UDP, length 1470
08:27:47.546842 IP 10.1.1.1.41027 > 8.8.4.4.8844: UDP, length 1470
08:27:47.558004 IP 10.1.1.1.41027 > 8.8.4.4.8844: UDP, length 1470
08:27:47.569265 IP 10.1.1.1.41027 > 8.8.4.4.8844: UDP, length 1470
08:27:47.580510 IP 10.1.1.1.41027 > 8.8.4.4.8844: UDP, length 1470
08:27:47.591680 IP 10.1.1.1.41027 > 8.8.4.4.8844: UDP, length 1470
08:27:47.602886 IP 10.1.1.1.41027 > 8.8.4.4.8844: UDP, length 1470
08:27:47.614213 IP 10.1.1.1.41027 > 8.8.4.4.8844: UDP, length 1470
08:27:47.625334 IP 10.1.1.1.41027 > 8.8.4.4.8844: UDP, length 1470
08:27:47.636522 IP 10.1.1.1.41027 > 8.8.4.4.8844: UDP, length 1470
08:27:47.647790 IP 10.1.1.1.41027 > 8.8.4.4.8844: UDP, length 1470
08:27:47.659023 IP 10.1.1.1.41027 > 8.8.4.4.8844: UDP, length 1470
08:27:47.670210 IP 10.1.1.1.41027 > 8.8.4.4.8844: UDP, length 1470
08:27:47.681520 IP 10.1.1.1.41027 > 8.8.4.4.8844: UDP, length 1470
08:27:47.692582 IP 10.1.1.1.41027 > 8.8.4.4.8844: UDP, length 1470
08:27:47.703797 IP 10.1.1.1.41027 > 8.8.4.4.8844: UDP, length 1470
08:27:47.715146 IP 10.1.1.1.41027 > 8.8.4.4.8844: UDP, length 1470
08:27:47.726305 IP 10.1.1.1.41027 > 8.8.4.4.8844: UDP, length 1470
08:27:47.737473 IP 10.1.1.1.41027 > 8.8.4.4.8844: UDP, length 1470
08:27:47.748730 IP 10.1.1.1.41027 > 8.8.4.4.8844: UDP, length 1470
08:27:47.759838 IP 10.1.1.1.41027 > 8.8.4.4.8844: UDP, length 1470
08:27:47.771077 IP 10.1.1.1.41027 > 8.8.4.4.8844: UDP, length 1470
08:27:47.782364 IP 10.1.1.1.41027 > 8.8.4.4.8844: UDP, length 1470
08:27:47.793564 IP 10.1.1.1.41027 > 8.8.4.4.8844: UDP, length 1470
08:27:47.804793 IP 10.1.1.1.41027 > 8.8.4.4.8844: UDP, length 1470
08:27:47.815915 IP 10.1.1.1.41027 > 8.8.4.4.8844: UDP, length 1470
08:27:47.827163 IP 10.1.1.1.41027 > 8.8.4.4.8844: UDP, length 1470
08:27:47.838470 IP 10.1.1.1.41027 > 8.8.4.4.8844: UDP, length 1470
08:27:47.849704 IP 10.1.1.1.41027 > 8.8.4.4.8844: UDP, length 1470
08:27:47.860805 IP 10.1.1.1.41027 > 8.8.4.4.8844: UDP, length 1470
08:27:47.872023 IP 10.1.1.1.41027 > 8.8.4.4.8844: UDP, length 1470
08:27:47.883238 IP 10.1.1.1.41027 > 8.8.4.4.8844: UDP, length 1470
08:27:47.894508 IP 10.1.1.1.41027 > 8.8.4.4.8844: UDP, length 1470
08:27:47.905727 IP 10.1.1.1.41027 > 8.8.4.4.8844: UDP, length 1470
08:27:47.916920 IP 10.1.1.1.41027 > 8.8.4.4.8844: UDP, length 1470
08:27:47.928085 IP 10.1.1.1.41027 > 8.8.4.4.8844: UDP, length 1470
08:27:47.939409 IP 10.1.1.1.41027 > 8.8.4.4.8844: UDP, length 1470
08:27:47.950501 IP 10.1.1.1.41027 > 8.8.4.4.8844: UDP, length 1470
08:27:47.961840 IP 10.1.1.1.41027 > 8.8.4.4.8844: UDP, length 1470
08:27:47.972972 IP 10.1.1.1.41027 > 8.8.4.4.8844: UDP, length 1470
08:27:47.984181 IP 10.1.1.1.41027 > 8.8.4.4.8844: UDP, length 1470
08:27:47.995392 IP 10.1.1.1.41027 > 8.8.4.4.8844: UDP, length 1470
08:27:48.006762 IP 10.1.1.1.41027 > 8.8.4.4.8844: UDP, length 1470
08:27:48.018011 IP 10.1.1.1.41027 > 8.8.4.4.8844: UDP, length 1470
08:27:48.029087 IP 10.1.1.1.41027 > 8.8.4.4.8844: UDP, length 1470
08:27:48.040348 IP 10.1.1.1.41027 > 8.8.4.4.8844: UDP, length 1470
08:27:48.051510 IP 10.1.1.1.41027 > 8.8.4.4.8844: UDP, length 1470
08:27:48.062700 IP 10.1.1.1.41027 > 8.8.4.4.8844: UDP, length 1470
08:27:48.074028 IP 10.1.1.1.41027 > 8.8.4.4.8844: UDP, length 1470
08:27:48.085115 IP 10.1.1.1.41027 > 8.8.4.4.8844: UDP, length 1470
08:27:48.096356 IP 10.1.1.1.41027 > 8.8.4.4.8844: UDP, length 1470
08:27:48.107648 IP 10.1.1.1.41027 > 8.8.4.4.8844: UDP, length 1470
08:27:48.118755 IP 10.1.1.1.41027 > 8.8.4.4.8844: UDP, length 1470
08:27:48.129997 IP 10.1.1.1.41027 > 8.8.4.4.8844: UDP, length 1470
08:27:48.141336 IP 10.1.1.1.41027 > 8.8.4.4.8844: UDP, length 1470
08:27:48.152789 IP 10.1.1.1.41027 > 8.8.4.4.8844: UDP, length 1470
08:27:48.163756 IP 10.1.1.1.41027 > 8.8.4.4.8844: UDP, length 1470
08:27:48.174931 IP 10.1.1.1.41027 > 8.8.4.4.8844: UDP, length 1470
08:27:48.186066 IP 10.1.1.1.41027 > 8.8.4.4.8844: UDP, length 1470
08:27:48.197297 IP 10.1.1.1.41027 > 8.8.4.4.8844: UDP, length 1470
08:27:48.208628 IP 10.1.1.1.41027 > 8.8.4.4.8844: UDP, length 1470
08:27:48.219804 IP 10.1.1.1.41027 > 8.8.4.4.8844: UDP, length 1470
08:27:48.230933 IP 10.1.1.1.41027 > 8.8.4.4.8844: UDP, length 1470
08:27:48.242165 IP 10.1.1.1.41027 > 8.8.4.4.8844: UDP, length 1470
08:27:48.253349 IP 10.1.1.1.41027 > 8.8.4.4.8844: UDP, length 1470
08:27:48.264628 IP 10.1.1.1.41027 > 8.8.4.4.8844: UDP, length 1470
08:27:48.275796 IP 10.1.1.1.41027 > 8.8.4.4.8844: UDP, length 1470
08:27:48.287107 IP 10.1.1.1.41027 > 8.8.4.4.8844: UDP, length 1470
08:27:48.298225 IP 10.1.1.1.41027 > 8.8.4.4.8844: UDP, length 1470
08:27:48.309480 IP 10.1.1.1.41027 > 8.8.4.4.8844: UDP, length 1470
08:27:48.320588 IP 10.1.1.1.41027 > 8.8.4.4.8844: UDP, length 1470
08:27:48.331896 IP 10.1.1.1.41027 > 8.8.4.4.8844: UDP, length 1470
08:27:48.343101 IP 10.1.1.1.41027 > 8.8.4.4.8844: UDP, length 1470
08:27:48.354231 IP 10.1.1.1.41027 > 8.8.4.4.8844: UDP, length 1470
08:27:48.365621 IP 10.1.1.1.41027 > 8.8.4.4.8844: UDP, length 1470
08:27:48.376743 IP 10.1.1.1.41027 > 8.8.4.4.8844: UDP, length 1470
08:27:48.388013 IP 10.1.1.1.41027 > 8.8.4.4.8844: UDP, length 1470
08:27:48.399179 IP 10.1.1.1.41027 > 8.8.4.4.8844: UDP, length 1470
08:27:48.410457 IP 10.1.1.1.41027 > 8.8.4.4.8844: UDP, length 1470
08:27:48.421578 IP 10.1.1.1.41027 > 8.8.4.4.8844: UDP, length 1470
08:27:48.432907 IP 10.1.1.1.41027 > 8.8.4.4.8844: UDP, length 1470
08:27:48.444008 IP 10.1.1.1.41027 > 8.8.4.4.8844: UDP, length 1470
08:27:48.455297 IP 10.1.1.1.41027 > 8.8.4.4.8844: UDP, length 1470
08:27:48.466390 IP 10.1.1.1.41027 > 8.8.4.4.8844: UDP, length 1470
08:27:48.477707 IP 10.1.1.1.41027 > 8.8.4.4.8844: UDP, length 1470
08:27:48.488968 IP 10.1.1.1.41027 > 8.8.4.4.8844: UDP, length 1470
08:27:48.500141 IP 10.1.1.1.41027 > 8.8.4.4.8844: UDP, length 1470
08:27:48.511338 IP 10.1.1.1.41027 > 8.8.4.4.8844: UDP, length 1470
08:27:48.522590 IP 10.1.1.1.41027 > 8.8.4.4.8844: UDP, length 1470
08:27:48.533812 IP 10.1.1.1.41027 > 8.8.4.4.8844: UDP, length 1470
08:27:48.544988 IP 10.1.1.1.41027 > 8.8.4.4.8844: UDP, length 1470
08:27:48.556144 IP 10.1.1.1.41027 > 8.8.4.4.8844: UDP, length 1470
08:27:48.567408 IP 10.1.1.1.41027 > 8.8.4.4.8844: UDP, length 1470
08:27:48.578574 IP 10.1.1.1.41027 > 8.8.4.4.8844: UDP, length 1470
08:27:48.589821 IP 10.1.1.1.41027 > 8.8.4.4.8844: UDP, length 1470
08:27:48.601078 IP 10.1.1.1.41027 > 8.8.4.4.8844: UDP, length 1470
08:27:48.612152 IP 10.1.1.1.41027 > 8.8.4.4.8844: UDP, length 1470
08:27:48.623376 IP 10.1.1.1.41027 > 8.8.4.4.8844: UDP, length 1470
08:27:48.634806 IP 10.1.1.1.41027 > 8.8.4.4.8844: UDP, length 1470
08:27:48.645904 IP 10.1.1.1.41027 > 8.8.4.4.8844: UDP, length 1470
08:27:48.657049 IP 10.1.1.1.41027 > 8.8.4.4.8844: UDP, length 1470
08:27:48.668301 IP 10.1.1.1.41027 > 8.8.4.4.8844: UDP, length 1470
08:27:48.679560 IP 10.1.1.1.41027 > 8.8.4.4.8844: UDP, length 1470
08:27:48.690772 IP 10.1.1.1.41027 > 8.8.4.4.8844: UDP, length 1470
08:27:48.702003 IP 10.1.1.1.41027 > 8.8.4.4.8844: UDP, length 1470
08:27:48.713223 IP 10.1.1.1.41027 > 8.8.4.4.8844: UDP, length 1470
08:27:48.724353 IP 10.1.1.1.41027 > 8.8.4.4.8844: UDP, length 1470
08:27:48.735655 IP 10.1.1.1.41027 > 8.8.4.4.8844: UDP, length 1470
08:27:48.746874 IP 10.1.1.1.41027 > 8.8.4.4.8844: UDP, length 1470
08:27:48.758026 IP 10.1.1.1.41027 > 8.8.4.4.8844: UDP, length 1470
08:27:48.769407 IP 10.1.1.1.41027 > 8.8.4.4.8844: UDP, length 1470
08:27:48.780521 IP 10.1.1.1.41027 > 8.8.4.4.8844: UDP, length 1470
08:27:48.791711 IP 10.1.1.1.41027 > 8.8.4.4.8844: UDP, length 1470
08:27:48.802938 IP 10.1.1.1.41027 > 8.8.4.4.8844: UDP, length 1470
08:27:48.814181 IP 10.1.1.1.41027 > 8.8.4.4.8844: UDP, length 1470
08:27:48.825366 IP 10.1.1.1.41027 > 8.8.4.4.8844: UDP, length 1470
08:27:48.836528 IP 10.1.1.1.41027 > 8.8.4.4.8844: UDP, length 1470
08:27:48.847759 IP 10.1.1.1.41027 > 8.8.4.4.8844: UDP, length 1470
08:27:48.858920 IP 10.1.1.1.41027 > 8.8.4.4.8844: UDP, length 1470
08:27:48.870168 IP 10.1.1.1.41027 > 8.8.4.4.8844: UDP, length 1470
08:27:48.881465 IP 10.1.1.1.41027 > 8.8.4.4.8844: UDP, length 1470
08:27:48.892706 IP 10.1.1.1.41027 > 8.8.4.4.8844: UDP, length 1470
08:27:48.903785 IP 10.1.1.1.41027 > 8.8.4.4.8844: UDP, length 1470
08:27:48.915014 IP 10.1.1.1.41027 > 8.8.4.4.8844: UDP, length 1470
08:27:48.926222 IP 10.1.1.1.41027 > 8.8.4.4.8844: UDP, length 1470
08:27:48.937489 IP 10.1.1.1.41027 > 8.8.4.4.8844: UDP, length 1470
08:27:48.948712 IP 10.1.1.1.41027 > 8.8.4.4.8844: UDP, length 1470
08:27:48.959813 IP 10.1.1.1.41027 > 8.8.4.4.8844: UDP, length 1470
08:27:48.971170 IP 10.1.1.1.41027 > 8.8.4.4.8844: UDP, length 1470
08:27:48.982365 IP 10.1.1.1.41027 > 8.8.4.4.8844: UDP, length 1470
08:27:48.993559 IP 10.1.1.1.41027 > 8.8.4.4.8844: UDP, length 1470
08:27:49.004836 IP 10.1.1.1.41027 > 8.8.4.4.8844: UDP, length 1470
08:27:49.015990 IP 10.1.1.1.41027 > 8.8.4.4.8844: UDP, length 1470
08:27:49.027170 IP 10.1.1.1.41027 > 8.8.4.4.8844: UDP, length 1470
08:27:49.038472 IP 10.1.1.1.41027 > 8.8.4.4.8844: UDP, length 1470
08:27:49.049674 IP 10.1.1.1.41027 > 8.8.4.4.8844: UDP, length 1470
08:27:49.060800 IP 10.1.1.1.41027 > 8.8.4.4.8844: UDP, length 1470
08:27:49.072044 IP 10.1.1.1.41027 > 8.8.4.4.8844: UDP, length 1470
08:27:49.083357 IP 10.1.1.1.41027 > 8.8.4.4.8844: UDP, length 1470
08:27:49.094424 IP 10.1.1.1.41027 > 8.8.4.4.8844: UDP, length 1470
08:27:49.105775 IP 10.1.1.1.41027 > 8.8.4.4.8844: UDP, length 1470
08:27:49.116998 IP 10.1.1.1.41027 > 8.8.4.4.8844: UDP, length 1470
08:27:49.128180 IP 10.1.1.1.41027 > 8.8.4.4.8844: UDP, length 1470
08:27:49.139418 IP 10.1.1.1.41027 > 8.8.4.4.8844: UDP, length 1470
08:27:49.150659 IP 10.1.1.1.41027 > 8.8.4.4.8844: UDP, length 1470
08:27:49.161712 IP 10.1.1.1.41027 > 8.8.4.4.8844: UDP, length 1470
08:27:49.173068 IP 10.1.1.1.41027 > 8.8.4.4.8844: UDP, length 1470
08:27:49.184205 IP 10.1.1.1.41027 > 8.8.4.4.8844: UDP, length 1470
08:27:49.195397 IP 10.1.1.1.41027 > 8.8.4.4.8844: UDP, length 1470
08:27:49.206615 IP 10.1.1.1.41027 > 8.8.4.4.8844: UDP, length 1470
08:27:49.217876 IP 10.1.1.1.41027 > 8.8.4.4.8844: UDP, length 1470
08:27:49.229102 IP 10.1.1.1.41027 > 8.8.4.4.8844: UDP, length 1470
08:27:49.240285 IP 10.1.1.1.41027 > 8.8.4.4.8844: UDP, length 1470
08:27:49.251584 IP 10.1.1.1.41027 > 8.8.4.4.8844: UDP, length 1470
08:27:49.262794 IP 10.1.1.1.41027 > 8.8.4.4.8844: UDP, length 1470
08:27:49.273888 IP 10.1.1.1.41027 > 8.8.4.4.8844: UDP, length 1470
08:27:49.285192 IP 10.1.1.1.41027 > 8.8.4.4.8844: UDP, length 1470
08:27:49.296374 IP 10.1.1.1.41027 > 8.8.4.4.8844: UDP, length 1470
08:27:49.307630 IP 10.1.1.1.41027 > 8.8.4.4.8844: UDP, length 1470
08:27:49.318804 IP 10.1.1.1.41027 > 8.8.4.4.8844: UDP, length 1470
08:27:49.330028 IP 10.1.1.1.41027 > 8.8.4.4.8844: UDP, length 1470
08:27:49.341147 IP 10.1.1.1.41027 > 8.8.4.4.8844: UDP, length 1470
08:27:49.352507 IP 10.1.1.1.41027 > 8.8.4.4.8844: UDP, length 1470
08:27:49.363631 IP 10.1.1.1.41027 > 8.8.4.4.8844: UDP, length 1470
08:27:49.374934 IP 10.1.1.1.41027 > 8.8.4.4.8844: UDP, length 1470
08:27:49.386180 IP 10.1.1.1.41027 > 8.8.4.4.8844: UDP, length 1470
08:27:49.397309 IP 10.1.1.1.41027 > 8.8.4.4.8844: UDP, length 1470
08:27:49.408522 IP 10.1.1.1.41027 > 8.8.4.4.8844: UDP, length 1470
08:27:49.419752 IP 10.1.1.1.41027 > 8.8.4.4.8844: UDP, length 1470
08:27:49.430988 IP 10.1.1.1.41027 > 8.8.4.4.8844: UDP, length 1470
08:27:49.442274 IP 10.1.1.1.41027 > 8.8.4.4.8844: UDP, length 1470
08:27:49.453533 IP 10.1.1.1.41027 > 8.8.4.4.8844: UDP, length 1470
08:27:49.464566 IP 10.1.1.1.41027 > 8.8.4.4.8844: UDP, length 1470
08:27:49.475817 IP 10.1.1.1.41027 > 8.8.4.4.8844: UDP, length 1470
08:27:49.486994 IP 10.1.1.1.41027 > 8.8.4.4.8844: UDP, length 1470
08:27:49.498276 IP 10.1.1.1.41027 > 8.8.4.4.8844: UDP, length 1470
08:27:49.509551 IP 10.1.1.1.41027 > 8.8.4.4.8844: UDP, length 1470
08:27:49.520794 IP 10.1.1.1.41027 > 8.8.4.4.8844: UDP, length 1470
08:27:49.531815 IP 10.1.1.1.41027 > 8.8.4.4.8844: UDP, length 1470
08:27:49.543166 IP 10.1.1.1.41027 > 8.8.4.4.8844: UDP, length 1470
08:27:49.554332 IP 10.1.1.1.41027 > 8.8.4.4.8844: UDP, length 1470
08:27:49.565721 IP 10.1.1.1.41027 > 8.8.4.4.8844: UDP, length 1470
08:27:49.576829 IP 10.1.1.1.41027 > 8.8.4.4.8844: UDP, length 1470
08:27:49.587935 IP 10.1.1.1.41027 > 8.8.4.4.8844: UDP, length 1470
08:27:49.599283 IP 10.1.1.1.41027 > 8.8.4.4.8844: UDP, length 1470
08:27:49.610425 IP 10.1.1.1.41027 > 8.8.4.4.8844: UDP, length 1470
08:27:49.621658 IP 10.1.1.1.41027 > 8.8.4.4.8844: UDP, length 1470
08:27:49.632813 IP 10.1.1.1.41027 > 8.8.4.4.8844: UDP, length 1470
08:27:49.644048 IP 10.1.1.1.41027 > 8.8.4.4.8844: UDP, length 1470
08:27:49.655317 IP 10.1.1.1.41027 > 8.8.4.4.8844: UDP, length 1470
08:27:49.666584 IP 10.1.1.1.41027 > 8.8.4.4.8844: UDP, length 1470
08:27:49.677766 IP 10.1.1.1.41027 > 8.8.4.4.8844: UDP, length 1470
08:27:49.688923 IP 10.1.1.1.41027 > 8.8.4.4.8844: UDP, length 1470
08:27:49.700123 IP 10.1.1.1.41027 > 8.8.4.4.8844: UDP, length 1470
08:27:49.711374 IP 10.1.1.1.41027 > 8.8.4.4.8844: UDP, length 1470
08:27:49.722565 IP 10.1.1.1.41027 > 8.8.4.4.8844: UDP, length 1470
08:27:49.733859 IP 10.1.1.1.41027 > 8.8.4.4.8844: UDP, length 1470
08:27:49.745031 IP 10.1.1.1.41027 > 8.8.4.4.8844: UDP, length 1470
08:27:49.756232 IP 10.1.1.1.41027 > 8.8.4.4.8844: UDP, length 1470
08:27:49.767456 IP 10.1.1.1.41027 > 8.8.4.4.8844: UDP, length 1470
08:27:49.778835 IP 10.1.1.1.41027 > 8.8.4.4.8844: UDP, length 1470
08:27:49.790048 IP 10.1.1.1.41027 > 8.8.4.4.8844: UDP, length 1470
08:27:49.801169 IP 10.1.1.1.41027 > 8.8.4.4.8844: UDP, length 1470
08:27:49.812403 IP 10.1.1.1.41027 > 8.8.4.4.8844: UDP, length 1470
08:27:49.823682 IP 10.1.1.1.41027 > 8.8.4.4.8844: UDP, length 1470
08:27:49.834840 IP 10.1.1.1.41027 > 8.8.4.4.8844: UDP, length 1470
08:27:49.846019 IP 10.1.1.1.41027 > 8.8.4.4.8844: UDP, length 1470
08:27:49.857151 IP 10.1.1.1.41027 > 8.8.4.4.8844: UDP, length 1470
08:27:49.868368 IP 10.1.1.1.41027 > 8.8.4.4.8844: UDP, length 1470
08:27:49.879734 IP 10.1.1.1.41027 > 8.8.4.4.8844: UDP, length 1470
08:27:49.891005 IP 10.1.1.1.41027 > 8.8.4.4.8844: UDP, length 1470
08:27:49.902108 IP 10.1.1.1.41027 > 8.8.4.4.8844: UDP, length 1470
08:27:49.913331 IP 10.1.1.1.41027 > 8.8.4.4.8844: UDP, length 1470
08:27:49.924528 IP 10.1.1.1.41027 > 8.8.4.4.8844: UDP, length 1470
08:27:49.935774 IP 10.1.1.1.41027 > 8.8.4.4.8844: UDP, length 1470
08:27:49.947014 IP 10.1.1.1.41027 > 8.8.4.4.8844: UDP, length 1470
08:27:49.958128 IP 10.1.1.1.41027 > 8.8.4.4.8844: UDP, length 1470
08:27:49.969364 IP 10.1.1.1.41027 > 8.8.4.4.8844: UDP, length 1470
08:27:49.980656 IP 10.1.1.1.41027 > 8.8.4.4.8844: UDP, length 1470
08:27:49.991782 IP 10.1.1.1.41027 > 8.8.4.4.8844: UDP, length 1470
08:27:50.003039 IP 10.1.1.1.41027 > 8.8.4.4.8844: UDP, length 1470
08:27:50.014280 IP 10.1.1.1.41027 > 8.8.4.4.8844: UDP, length 1470
08:27:50.025313 IP 10.1.1.1.41027 > 8.8.4.4.8844: UDP, length 1470
08:27:50.036559 IP 10.1.1.1.41027 > 8.8.4.4.8844: UDP, length 1470
08:27:50.047792 IP 10.1.1.1.41027 > 8.8.4.4.8844: UDP, length 1470
08:27:50.059107 IP 10.1.1.1.41027 > 8.8.4.4.8844: UDP, length 1470
08:27:50.070211 IP 10.1.1.1.41027 > 8.8.4.4.8844: UDP, length 1470
08:27:50.081526 IP 10.1.1.1.41027 > 8.8.4.4.8844: UDP, length 1470
08:27:50.092621 IP 10.1.1.1.41027 > 8.8.4.4.8844: UDP, length 1470
08:27:50.103824 IP 10.1.1.1.41027 > 8.8.4.4.8844: UDP, length 1470
08:27:50.115139 IP 10.1.1.1.41027 > 8.8.4.4.8844: UDP, length 1470
08:27:50.126398 IP 10.1.1.1.41027 > 8.8.4.4.8844: UDP, length 1470
08:27:50.137697 IP 10.1.1.1.41027 > 8.8.4.4.8844: UDP, length 1470
08:27:50.148927 IP 10.1.1.1.41027 > 8.8.4.4.8844: UDP, length 1470
08:27:50.160010 IP 10.1.1.1.41027 > 8.8.4.4.8844: UDP, length 1470
08:27:50.171268 IP 10.1.1.1.41027 > 8.8.4.4.8844: UDP, length 1470
08:27:50.182496 IP 10.1.1.1.41027 > 8.8.4.4.8844: UDP, length 1470
08:27:50.193715 IP 10.1.1.1.41027 > 8.8.4.4.8844: UDP, length 1470
08:27:50.204950 IP 10.1.1.1.41027 > 8.8.4.4.8844: UDP, length 1470
08:27:50.216084 IP 10.1.1.1.41027 > 8.8.4.4.8844: UDP, length 1470
08:27:50.227329 IP 10.1.1.1.41027 > 8.8.4.4.8844: UDP, length 1470
08:27:50.238591 IP 10.1.1.1.41027 > 8.8.4.4.8844: UDP, length 1470
08:27:50.249810 IP 10.1.1.1.41027 > 8.8.4.4.8844: UDP, length 1470
08:27:50.260855 IP 10.1.1.1.41027 > 8.8.4.4.8844: UDP, length 1470
08:27:50.272153 IP 10.1.1.1.41027 > 8.8.4.4.8844: UDP, length 1470
08:27:50.283432 IP 10.1.1.1.41027 > 8.8.4.4.8844: UDP, length 1470
08:27:50.294545 IP 10.1.1.1.41027 > 8.8.4.4.8844: UDP, length 1470
08:27:50.305912 IP 10.1.1.1.41027 > 8.8.4.4.8844: UDP, length 1470
08:27:50.317135 IP 10.1.1.1.41027 > 8.8.4.4.8844: UDP, length 1470
08:27:50.328218 IP 10.1.1.1.41027 > 8.8.4.4.8844: UDP, length 1470
08:27:50.339586 IP 10.1.1.1.41027 > 8.8.4.4.8844: UDP, length 1470
08:27:50.350800 IP 10.1.1.1.41027 > 8.8.4.4.8844: UDP, length 1470
08:27:50.361960 IP 10.1.1.1.41027 > 8.8.4.4.8844: UDP, length 1470
08:27:50.373200 IP 10.1.1.1.41027 > 8.8.4.4.8844: UDP, length 1470
08:27:50.384242 IP 10.1.1.1.41027 > 8.8.4.4.8844: UDP, length 1470
08:27:50.395443 IP 10.1.1.1.41027 > 8.8.4.4.8844: UDP, length 1470
08:27:50.406823 IP 10.1.1.1.41027 > 8.8.4.4.8844: UDP, length 1470
08:27:50.417984 IP 10.1.1.1.41027 > 8.8.4.4.8844: UDP, length 1470
08:27:50.429196 IP 10.1.1.1.41027 > 8.8.4.4.8844: UDP, length 1470
08:27:50.440371 IP 10.1.1.1.41027 > 8.8.4.4.8844: UDP, length 1470
08:27:50.451690 IP 10.1.1.1.41027 > 8.8.4.4.8844: UDP, length 1470
08:27:50.462777 IP 10.1.1.1.41027 > 8.8.4.4.8844: UDP, length 1470
08:27:50.474191 IP 10.1.1.1.41027 > 8.8.4.4.8844: UDP, length 1470
08:27:50.485195 IP 10.1.1.1.41027 > 8.8.4.4.8844: UDP, length 1470
08:27:50.496388 IP 10.1.1.1.41027 > 8.8.4.4.8844: UDP, length 1470
08:27:50.507685 IP 10.1.1.1.41027 > 8.8.4.4.8844: UDP, length 1470
08:27:50.518880 IP 10.1.1.1.41027 > 8.8.4.4.8844: UDP, length 1470
08:27:50.530003 IP 10.1.1.1.41027 > 8.8.4.4.8844: UDP, length 1470
08:27:50.541311 IP 10.1.1.1.41027 > 8.8.4.4.8844: UDP, length 1470
08:27:50.552494 IP 10.1.1.1.41027 > 8.8.4.4.8844: UDP, length 1470
08:27:50.563755 IP 10.1.1.1.41027 > 8.8.4.4.8844: UDP, length 1470
08:27:50.574888 IP 10.1.1.1.41027 > 8.8.4.4.8844: UDP, length 1470
08:27:50.586095 IP 10.1.1.1.41027 > 8.8.4.4.8844: UDP, length 1470
08:27:50.597378 IP 10.1.1.1.41027 > 8.8.4.4.8844: UDP, length 1470
08:27:50.608636 IP 10.1.1.1.41027 > 8.8.4.4.8844: UDP, length 1470
08:27:50.619740 IP 10.1.1.1.41027 > 8.8.4.4.8844: UDP, length 1470
08:27:50.630975 IP 10.1.1.1.41027 > 8.8.4.4.8844: UDP, length 1470
08:27:50.642362 IP 10.1.1.1.41027 > 8.8.4.4.8844: UDP, length 1470
08:27:50.653494 IP 10.1.1.1.41027 > 8.8.4.4.8844: UDP, length 1470
08:27:50.664589 IP 10.1.1.1.41027 > 8.8.4.4.8844: UDP, length 1470
08:27:50.675818 IP 10.1.1.1.41027 > 8.8.4.4.8844: UDP, length 1470
08:27:50.687027 IP 10.1.1.1.41027 > 8.8.4.4.8844: UDP, length 1470
08:27:50.698259 IP 10.1.1.1.41027 > 8.8.4.4.8844: UDP, length 1470
08:27:50.709752 IP 10.1.1.1.41027 > 8.8.4.4.8844: UDP, length 1470
08:27:50.720891 IP 10.1.1.1.41027 > 8.8.4.4.8844: UDP, length 1470
08:27:50.732035 IP 10.1.1.1.41027 > 8.8.4.4.8844: UDP, length 1470
08:27:50.743355 IP 10.1.1.1.41027 > 8.8.4.4.8844: UDP, length 1470
08:27:50.754451 IP 10.1.1.1.41027 > 8.8.4.4.8844: UDP, length 1470
08:27:50.765592 IP 10.1.1.1.41027 > 8.8.4.4.8844: UDP, length 1470
08:27:50.777013 IP 10.1.1.1.41027 > 8.8.4.4.8844: UDP, length 1470
08:27:50.787929 IP 10.1.1.1.41027 > 8.8.4.4.8844: UDP, length 1470
08:27:50.799117 IP 10.1.1.1.41027 > 8.8.4.4.8844: UDP, length 1470
08:27:50.810440 IP 10.1.1.1.41027 > 8.8.4.4.8844: UDP, length 1470
08:27:50.821620 IP 10.1.1.1.41027 > 8.8.4.4.8844: UDP, length 1470
08:27:50.832906 IP 10.1.1.1.41027 > 8.8.4.4.8844: UDP, length 1470
08:27:50.844067 IP 10.1.1.1.41027 > 8.8.4.4.8844: UDP, length 1470
08:27:50.855275 IP 10.1.1.1.41027 > 8.8.4.4.8844: UDP, length 1470
08:27:50.866462 IP 10.1.1.1.41027 > 8.8.4.4.8844: UDP, length 1470
08:27:50.877879 IP 10.1.1.1.41027 > 8.8.4.4.8844: UDP, length 1470
08:27:50.889109 IP 10.1.1.1.41027 > 8.8.4.4.8844: UDP, length 1470
08:27:50.900169 IP 10.1.1.1.41027 > 8.8.4.4.8844: UDP, length 1470
08:27:50.911507 IP 10.1.1.1.41027 > 8.8.4.4.8844: UDP, length 1470
08:27:50.922775 IP 10.1.1.1.41027 > 8.8.4.4.8844: UDP, length 1470
08:27:50.933815 IP 10.1.1.1.41027 > 8.8.4.4.8844: UDP, length 1470
08:27:50.945190 IP 10.1.1.1.41027 > 8.8.4.4.8844: UDP, length 1470
08:27:50.956342 IP 10.1.1.1.41027 > 8.8.4.4.8844: UDP, length 1470
08:27:50.967459 IP 10.1.1.1.41027 > 8.8.4.4.8844: UDP, length 1470
08:27:50.978679 IP 10.1.1.1.41027 > 8.8.4.4.8844: UDP, length 1470
08:27:50.989929 IP 10.1.1.1.41027 > 8.8.4.4.8844: UDP, length 1470
08:27:51.001083 IP 10.1.1.1.41027 > 8.8.4.4.8844: UDP, length 1470
08:27:51.012295 IP 10.1.1.1.41027 > 8.8.4.4.8844: UDP, length 1470
08:27:51.023728 IP 10.1.1.1.41027 > 8.8.4.4.8844: UDP, length 1470
08:27:51.034894 IP 10.1.1.1.41027 > 8.8.4.4.8844: UDP, length 1470
08:27:51.046014 IP 10.1.1.1.41027 > 8.8.4.4.8844: UDP, length 1470
08:27:51.057276 IP 10.1.1.1.41027 > 8.8.4.4.8844: UDP, length 1470
08:27:51.068409 IP 10.1.1.1.41027 > 8.8.4.4.8844: UDP, length 1470
08:27:51.079650 IP 10.1.1.1.41027 > 8.8.4.4.8844: UDP, length 1470
08:27:51.090952 IP 10.1.1.1.41027 > 8.8.4.4.8844: UDP, length 1470
08:27:51.102071 IP 10.1.1.1.41027 > 8.8.4.4.8844: UDP, length 1470
08:27:51.113257 IP 10.1.1.1.41027 > 8.8.4.4.8844: UDP, length 1470
08:27:51.124468 IP 10.1.1.1.41027 > 8.8.4.4.8844: UDP, length 1470
08:27:51.135683 IP 10.1.1.1.41027 > 8.8.4.4.8844: UDP, length 1470
08:27:51.146937 IP 10.1.1.1.41027 > 8.8.4.4.8844: UDP, length 1470
08:27:51.158152 IP 10.1.1.1.41027 > 8.8.4.4.8844: UDP, length 1470
08:27:51.169277 IP 10.1.1.1.41027 > 8.8.4.4.8844: UDP, length 1470
08:27:51.180661 IP 10.1.1.1.41027 > 8.8.4.4.8844: UDP, length 1470
08:27:51.191784 IP 10.1.1.1.41027 > 8.8.4.4.8844: UDP, length 1470
08:27:51.203031 IP 10.1.1.1.41027 > 8.8.4.4.8844: UDP, length 1470
08:27:51.214331 IP 10.1.1.1.41027 > 8.8.4.4.8844: UDP, length 1470
08:27:51.225486 IP 10.1.1.1.41027 > 8.8.4.4.8844: UDP, length 1470
08:27:51.236662 IP 10.1.1.1.41027 > 8.8.4.4.8844: UDP, length 1470
08:27:51.247858 IP 10.1.1.1.41027 > 8.8.4.4.8844: UDP, length 1470
08:27:51.259124 IP 10.1.1.1.41027 > 8.8.4.4.8844: UDP, length 1470
08:27:51.270297 IP 10.1.1.1.41027 > 8.8.4.4.8844: UDP, length 1470
08:27:51.281564 IP 10.1.1.1.41027 > 8.8.4.4.8844: UDP, length 1470
08:27:51.292815 IP 10.1.1.1.41027 > 8.8.4.4.8844: UDP, length 1470
08:27:51.303844 IP 10.1.1.1.41027 > 8.8.4.4.8844: UDP, length 1470
08:27:51.315216 IP 10.1.1.1.41027 > 8.8.4.4.8844: UDP, length 1470
08:27:51.326342 IP 10.1.1.1.41027 > 8.8.4.4.8844: UDP, length 1470
08:27:51.337499 IP 10.1.1.1.41027 > 8.8.4.4.8844: UDP, length 1470
08:27:51.348871 IP 10.1.1.1.41027 > 8.8.4.4.8844: UDP, length 1470
08:27:51.359958 IP 10.1.1.1.41027 > 8.8.4.4.8844: UDP, length 1470
08:27:51.371274 IP 10.1.1.1.41027 > 8.8.4.4.8844: UDP, length 1470
08:27:51.382565 IP 10.1.1.1.41027 > 8.8.4.4.8844: UDP, length 1470
08:27:51.393729 IP 10.1.1.1.41027 > 8.8.4.4.8844: UDP, length 1470
08:27:51.404914 IP 10.1.1.1.41027 > 8.8.4.4.8844: UDP, length 1470
08:27:51.416087 IP 10.1.1.1.41027 > 8.8.4.4.8844: UDP, length 1470
08:27:51.427346 IP 10.1.1.1.41027 > 8.8.4.4.8844: UDP, length 1470
08:27:51.438474 IP 10.1.1.1.41027 > 8.8.4.4.8844: UDP, length 1470
08:27:51.449784 IP 10.1.1.1.41027 > 8.8.4.4.8844: UDP, length 1470
08:27:51.460994 IP 10.1.1.1.41027 > 8.8.4.4.8844: UDP, length 1470
08:27:51.472104 IP 10.1.1.1.41027 > 8.8.4.4.8844: UDP, length 1470
08:27:51.483476 IP 10.1.1.1.41027 > 8.8.4.4.8844: UDP, length 1470
08:27:51.494631 IP 10.1.1.1.41027 > 8.8.4.4.8844: UDP, length 1470
08:27:51.505932 IP 10.1.1.1.41027 > 8.8.4.4.8844: UDP, length 1470
08:27:51.517225 IP 10.1.1.1.41027 > 8.8.4.4.8844: UDP, length 1470
08:27:51.528327 IP 10.1.1.1.41027 > 8.8.4.4.8844: UDP, length 1470
08:27:51.539522 IP 10.1.1.1.41027 > 8.8.4.4.8844: UDP, length 1470
08:27:51.550746 IP 10.1.1.1.41027 > 8.8.4.4.8844: UDP, length 1470
08:27:51.561991 IP 10.1.1.1.41027 > 8.8.4.4.8844: UDP, length 1470
08:27:51.573171 IP 10.1.1.1.41027 > 8.8.4.4.8844: UDP, length 1470
08:27:51.584259 IP 10.1.1.1.41027 > 8.8.4.4.8844: UDP, length 1470
08:27:51.595508 IP 10.1.1.1.41027 > 8.8.4.4.8844: UDP, length 1470
08:27:51.606841 IP 10.1.1.1.41027 > 8.8.4.4.8844: UDP, length 1470
08:27:51.617996 IP 10.1.1.1.41027 > 8.8.4.4.8844: UDP, length 1470
08:27:51.629085 IP 10.1.1.1.41027 > 8.8.4.4.8844: UDP, length 1470
08:27:51.640264 IP 10.1.1.1.41027 > 8.8.4.4.8844: UDP, length 1470
08:27:51.651670 IP 10.1.1.1.41027 > 8.8.4.4.8844: UDP, length 1470
08:27:51.662800 IP 10.1.1.1.41027 > 8.8.4.4.8844: UDP, length 1470
08:27:51.674057 IP 10.1.1.1.41027 > 8.8.4.4.8844: UDP, length 1470
08:27:51.685263 IP 10.1.1.1.41027 > 8.8.4.4.8844: UDP, length 1470
08:27:51.696453 IP 10.1.1.1.41027 > 8.8.4.4.8844: UDP, length 1470
08:27:51.707637 IP 10.1.1.1.41027 > 8.8.4.4.8844: UDP, length 1470
08:27:51.718857 IP 10.1.1.1.41027 > 8.8.4.4.8844: UDP, length 1470
08:27:51.730112 IP 10.1.1.1.41027 > 8.8.4.4.8844: UDP, length 1470
08:27:51.741589 IP 10.1.1.1.41027 > 8.8.4.4.8844: UDP, length 1470
08:27:51.752596 IP 10.1.1.1.41027 > 8.8.4.4.8844: UDP, length 1470
08:27:51.763826 IP 10.1.1.1.41027 > 8.8.4.4.8844: UDP, length 1470
08:27:51.775102 IP 10.1.1.1.41027 > 8.8.4.4.8844: UDP, length 1470
08:27:51.786318 IP 10.1.1.1.41027 > 8.8.4.4.8844: UDP, length 1470
08:27:51.797460 IP 10.1.1.1.41027 > 8.8.4.4.8844: UDP, length 1470
08:27:51.808634 IP 10.1.1.1.41027 > 8.8.4.4.8844: UDP, length 1470
08:27:51.819783 IP 10.1.1.1.41027 > 8.8.4.4.8844: UDP, length 1470
08:27:51.830982 IP 10.1.1.1.41027 > 8.8.4.4.8844: UDP, length 1470
08:27:51.842278 IP 10.1.1.1.41027 > 8.8.4.4.8844: UDP, length 1470
08:27:51.853494 IP 10.1.1.1.41027 > 8.8.4.4.8844: UDP, length 1470
08:27:51.864643 IP 10.1.1.1.41027 > 8.8.4.4.8844: UDP, length 1470
08:27:51.875892 IP 10.1.1.1.41027 > 8.8.4.4.8844: UDP, length 1470
08:27:51.887107 IP 10.1.1.1.41027 > 8.8.4.4.8844: UDP, length 1470
08:27:51.898383 IP 10.1.1.1.41027 > 8.8.4.4.8844: UDP, length 1470
08:27:51.909572 IP 10.1.1.1.41027 > 8.8.4.4.8844: UDP, length 1470
08:27:51.920823 IP 10.1.1.1.41027 > 8.8.4.4.8844: UDP, length 1470
08:27:51.931858 IP 10.1.1.1.41027 > 8.8.4.4.8844: UDP, length 1470
08:27:51.943209 IP 10.1.1.1.41027 > 8.8.4.4.8844: UDP, length 1470
08:27:51.954299 IP 10.1.1.1.41027 > 8.8.4.4.8844: UDP, length 1470
08:27:51.965579 IP 10.1.1.1.41027 > 8.8.4.4.8844: UDP, length 1470
08:27:51.976768 IP 10.1.1.1.41027 > 8.8.4.4.8844: UDP, length 1470
08:27:51.987944 IP 10.1.1.1.41027 > 8.8.4.4.8844: UDP, length 1470
08:27:51.999283 IP 10.1.1.1.41027 > 8.8.4.4.8844: UDP, length 1470
08:27:52.010422 IP 10.1.1.1.41027 > 8.8.4.4.8844: UDP, length 1470
08:27:52.021720 IP 10.1.1.1.41027 > 8.8.4.4.8844: UDP, length 1470
08:27:52.032950 IP 10.1.1.1.41027 > 8.8.4.4.8844: UDP, length 1470
08:27:52.044016 IP 10.1.1.1.41027 > 8.8.4.4.8844: UDP, length 1470
08:27:52.055358 IP 10.1.1.1.41027 > 8.8.4.4.8844: UDP, length 1470
08:27:52.066598 IP 10.1.1.1.41027 > 8.8.4.4.8844: UDP, length 1470
08:27:52.077702 IP 10.1.1.1.41027 > 8.8.4.4.8844: UDP, length 1470
08:27:52.088997 IP 10.1.1.1.41027 > 8.8.4.4.8844: UDP, length 1470
08:27:52.100171 IP 10.1.1.1.41027 > 8.8.4.4.8844: UDP, length 1470
08:27:52.111456 IP 10.1.1.1.41027 > 8.8.4.4.8844: UDP, length 1470
08:27:52.122663 IP 10.1.1.1.41027 > 8.8.4.4.8844: UDP, length 1470
08:27:52.133757 IP 10.1.1.1.41027 > 8.8.4.4.8844: UDP, length 1470
08:27:52.144972 IP 10.1.1.1.41027 > 8.8.4.4.8844: UDP, length 1470
08:27:52.156204 IP 10.1.1.1.41027 > 8.8.4.4.8844: UDP, length 1470
08:27:52.167550 IP 10.1.1.1.41027 > 8.8.4.4.8844: UDP, length 1470
08:27:52.178622 IP 10.1.1.1.41027 > 8.8.4.4.8844: UDP, length 1470
08:27:52.189957 IP 10.1.1.1.41027 > 8.8.4.4.8844: UDP, length 1470
08:27:52.201217 IP 10.1.1.1.41027 > 8.8.4.4.8844: UDP, length 1470
08:27:52.212291 IP 10.1.1.1.41027 > 8.8.4.4.8844: UDP, length 1470
08:27:52.223557 IP 10.1.1.1.41027 > 8.8.4.4.8844: UDP, length 1470
08:27:52.234686 IP 10.1.1.1.41027 > 8.8.4.4.8844: UDP, length 1470
08:27:52.245930 IP 10.1.1.1.41027 > 8.8.4.4.8844: UDP, length 1470
08:27:52.257090 IP 10.1.1.1.41027 > 8.8.4.4.8844: UDP, length 1470
08:27:52.268352 IP 10.1.1.1.41027 > 8.8.4.4.8844: UDP, length 1470
08:27:52.279616 IP 10.1.1.1.41027 > 8.8.4.4.8844: UDP, length 1470
08:27:52.290836 IP 10.1.1.1.41027 > 8.8.4.4.8844: UDP, length 1470
08:27:52.302088 IP 10.1.1.1.41027 > 8.8.4.4.8844: UDP, length 1470
08:27:52.313166 IP 10.1.1.1.41027 > 8.8.4.4.8844: UDP, length 1470
08:27:52.324482 IP 10.1.1.1.41027 > 8.8.4.4.8844: UDP, length 1470
08:27:52.335717 IP 10.1.1.1.41027 > 8.8.4.4.8844: UDP, length 1470
08:27:52.346946 IP 10.1.1.1.41027 > 8.8.4.4.8844: UDP, length 1470
08:27:52.358140 IP 10.1.1.1.41027 > 8.8.4.4.8844: UDP, length 1470
08:27:52.369360 IP 10.1.1.1.41027 > 8.8.4.4.8844: UDP, length 1470
08:27:52.380597 IP 10.1.1.1.41027 > 8.8.4.4.8844: UDP, length 1470
08:27:52.391727 IP 10.1.1.1.41027 > 8.8.4.4.8844: UDP, length 1470
08:27:52.402996 IP 10.1.1.1.41027 > 8.8.4.4.8844: UDP, length 1470
08:27:52.414178 IP 10.1.1.1.41027 > 8.8.4.4.8844: UDP, length 1470
08:27:52.425447 IP 10.1.1.1.41027 > 8.8.4.4.8844: UDP, length 1470
08:27:52.436662 IP 10.1.1.1.41027 > 8.8.4.4.8844: UDP, length 1470
08:27:52.447783 IP 10.1.1.1.41027 > 8.8.4.4.8844: UDP, length 1470
08:27:52.459111 IP 10.1.1.1.41027 > 8.8.4.4.8844: UDP, length 1470
08:27:52.470310 IP 10.1.1.1.41027 > 8.8.4.4.8844: UDP, length 1470
08:27:52.481556 IP 10.1.1.1.41027 > 8.8.4.4.8844: UDP, length 1470
08:27:52.492768 IP 10.1.1.1.41027 > 8.8.4.4.8844: UDP, length 1470
08:27:52.503851 IP 10.1.1.1.41027 > 8.8.4.4.8844: UDP, length 1470
08:27:52.515204 IP 10.1.1.1.41027 > 8.8.4.4.8844: UDP, length 1470
08:27:52.526403 IP 10.1.1.1.41027 > 8.8.4.4.8844: UDP, length 1470
08:27:52.537589 IP 10.1.1.1.41027 > 8.8.4.4.8844: UDP, length 1470
08:27:52.548863 IP 10.1.1.1.41027 > 8.8.4.4.8844: UDP, length 1470
08:27:52.559912 IP 10.1.1.1.41027 > 8.8.4.4.8844: UDP, length 1470
08:27:52.571284 IP 10.1.1.1.41027 > 8.8.4.4.8844: UDP, length 1470
08:27:52.582505 IP 10.1.1.1.41027 > 8.8.4.4.8844: UDP, length 1470
08:27:52.593558 IP 10.1.1.1.41027 > 8.8.4.4.8844: UDP, length 1470
08:27:52.604825 IP 10.1.1.1.41027 > 8.8.4.4.8844: UDP, length 1470
08:27:52.616011 IP 10.1.1.1.41027 > 8.8.4.4.8844: UDP, length 1470
08:27:52.627374 IP 10.1.1.1.41027 > 8.8.4.4.8844: UDP, length 1470
08:27:52.638597 IP 10.1.1.1.41027 > 8.8.4.4.8844: UDP, length 1470
08:27:52.649796 IP 10.1.1.1.41027 > 8.8.4.4.8844: UDP, length 1470
08:27:52.660884 IP 10.1.1.1.41027 > 8.8.4.4.8844: UDP, length 1470
08:27:52.672131 IP 10.1.1.1.41027 > 8.8.4.4.8844: UDP, length 1470
08:27:52.683431 IP 10.1.1.1.41027 > 8.8.4.4.8844: UDP, length 1470
08:27:52.694517 IP 10.1.1.1.41027 > 8.8.4.4.8844: UDP, length 1470
08:27:52.705775 IP 10.1.1.1.41027 > 8.8.4.4.8844: UDP, length 1470
08:27:52.717058 IP 10.1.1.1.41027 > 8.8.4.4.8844: UDP, length 1470
08:27:52.728187 IP 10.1.1.1.41027 > 8.8.4.4.8844: UDP, length 1470
08:27:52.739426 IP 10.1.1.1.41027 > 8.8.4.4.8844: UDP, length 1470
08:27:52.750716 IP 10.1.1.1.41027 > 8.8.4.4.8844: UDP, length 1470
08:27:52.761827 IP 10.1.1.1.41027 > 8.8.4.4.8844: UDP, length 1470
08:27:52.773192 IP 10.1.1.1.41027 > 8.8.4.4.8844: UDP, length 1470
08:27:52.784281 IP 10.1.1.1.41027 > 8.8.4.4.8844: UDP, length 1470
08:27:52.795454 IP 10.1.1.1.41027 > 8.8.4.4.8844: UDP, length 1470
08:27:52.806815 IP 10.1.1.1.41027 > 8.8.4.4.8844: UDP, length 1470
08:27:52.818005 IP 10.1.1.1.41027 > 8.8.4.4.8844: UDP, length 1470
08:27:52.829049 IP 10.1.1.1.41027 > 8.8.4.4.8844: UDP, length 1470
08:27:52.840301 IP 10.1.1.1.41027 > 8.8.4.4.8844: UDP, length 1470
08:27:52.851622 IP 10.1.1.1.41027 > 8.8.4.4.8844: UDP, length 1470
08:27:52.862742 IP 10.1.1.1.41027 > 8.8.4.4.8844: UDP, length 1470
08:27:52.874186 IP 10.1.1.1.41027 > 8.8.4.4.8844: UDP, length 1470
08:27:52.885318 IP 10.1.1.1.41027 > 8.8.4.4.8844: UDP, length 1470
08:27:52.896406 IP 10.1.1.1.41027 > 8.8.4.4.8844: UDP, length 1470
08:27:52.907750 IP 10.1.1.1.41027 > 8.8.4.4.8844: UDP, length 1470
08:27:52.918792 IP 10.1.1.1.41027 > 8.8.4.4.8844: UDP, length 1470
08:27:52.930039 IP 10.1.1.1.41027 > 8.8.4.4.8844: UDP, length 1470
08:27:52.941379 IP 10.1.1.1.41027 > 8.8.4.4.8844: UDP, length 1470
08:27:52.952490 IP 10.1.1.1.41027 > 8.8.4.4.8844: UDP, length 1470
08:27:52.963742 IP 10.1.1.1.41027 > 8.8.4.4.8844: UDP, length 1470
08:27:52.974949 IP 10.1.1.1.41027 > 8.8.4.4.8844: UDP, length 1470
08:27:52.986083 IP 10.1.1.1.41027 > 8.8.4.4.8844: UDP, length 1470
08:27:52.997334 IP 10.1.1.1.41027 > 8.8.4.4.8844: UDP, length 1470
08:27:53.008547 IP 10.1.1.1.41027 > 8.8.4.4.8844: UDP, length 1470
08:27:53.019760 IP 10.1.1.1.41027 > 8.8.4.4.8844: UDP, length 1470
08:27:53.030950 IP 10.1.1.1.41027 > 8.8.4.4.8844: UDP, length 1470
08:27:53.042285 IP 10.1.1.1.41027 > 8.8.4.4.8844: UDP, length 1470
08:27:53.053514 IP 10.1.1.1.41027 > 8.8.4.4.8844: UDP, length 1470
08:27:53.064622 IP 10.1.1.1.41027 > 8.8.4.4.8844: UDP, length 1470
08:27:53.075820 IP 10.1.1.1.41027 > 8.8.4.4.8844: UDP, length 1470
08:27:53.087163 IP 10.1.1.1.41027 > 8.8.4.4.8844: UDP, length 1470
08:27:53.098333 IP 10.1.1.1.41027 > 8.8.4.4.8844: UDP, length 1470
08:27:53.109534 IP 10.1.1.1.41027 > 8.8.4.4.8844: UDP, length 1470
08:27:53.120753 IP 10.1.1.1.41027 > 8.8.4.4.8844: UDP, length 1470
08:27:53.131871 IP 10.1.1.1.41027 > 8.8.4.4.8844: UDP, length 1470
08:27:53.143099 IP 10.1.1.1.41027 > 8.8.4.4.8844: UDP, length 1470
08:27:53.154399 IP 10.1.1.1.41027 > 8.8.4.4.8844: UDP, length 1470
08:27:53.165649 IP 10.1.1.1.41027 > 8.8.4.4.8844: UDP, length 1470
08:27:53.176864 IP 10.1.1.1.41027 > 8.8.4.4.8844: UDP, length 1470
08:27:53.187954 IP 10.1.1.1.41027 > 8.8.4.4.8844: UDP, length 1470
08:27:53.199172 IP 10.1.1.1.41027 > 8.8.4.4.8844: UDP, length 1470
08:27:53.210460 IP 10.1.1.1.41027 > 8.8.4.4.8844: UDP, length 1470
08:27:53.221711 IP 10.1.1.1.41027 > 8.8.4.4.8844: UDP, length 1470
08:27:53.232935 IP 10.1.1.1.41027 > 8.8.4.4.8844: UDP, length 1470
08:27:53.244060 IP 10.1.1.1.41027 > 8.8.4.4.8844: UDP, length 1470
08:27:53.255347 IP 10.1.1.1.41027 > 8.8.4.4.8844: UDP, length 1470
08:27:53.266552 IP 10.1.1.1.41027 > 8.8.4.4.8844: UDP, length 1470
08:27:53.277672 IP 10.1.1.1.41027 > 8.8.4.4.8844: UDP, length 1470
08:27:53.288981 IP 10.1.1.1.41027 > 8.8.4.4.8844: UDP, length 1470
08:27:53.300138 IP 10.1.1.1.41027 > 8.8.4.4.8844: UDP, length 1470
08:27:53.311375 IP 10.1.1.1.41027 > 8.8.4.4.8844: UDP, length 1470
08:27:53.322651 IP 10.1.1.1.41027 > 8.8.4.4.8844: UDP, length 1470
08:27:53.333865 IP 10.1.1.1.41027 > 8.8.4.4.8844: UDP, length 1470
08:27:53.345026 IP 10.1.1.1.41027 > 8.8.4.4.8844: UDP, length 1470
08:27:53.356194 IP 10.1.1.1.41027 > 8.8.4.4.8844: UDP, length 1470
08:27:53.367516 IP 10.1.1.1.41027 > 8.8.4.4.8844: UDP, length 1470
08:27:53.378668 IP 10.1.1.1.41027 > 8.8.4.4.8844: UDP, length 1470
08:27:53.389943 IP 10.1.1.1.41027 > 8.8.4.4.8844: UDP, length 1470
08:27:53.401139 IP 10.1.1.1.41027 > 8.8.4.4.8844: UDP, length 1470
08:27:53.412323 IP 10.1.1.1.41027 > 8.8.4.4.8844: UDP, length 1470
08:27:53.423583 IP 10.1.1.1.41027 > 8.8.4.4.8844: UDP, length 1470
08:27:53.434816 IP 10.1.1.1.41027 > 8.8.4.4.8844: UDP, length 1470
08:27:53.446040 IP 10.1.1.1.41027 > 8.8.4.4.8844: UDP, length 1470
08:27:53.457238 IP 10.1.1.1.41027 > 8.8.4.4.8844: UDP, length 1470
08:27:53.468464 IP 10.1.1.1.41027 > 8.8.4.4.8844: UDP, length 1470
08:27:53.479705 IP 10.1.1.1.41027 > 8.8.4.4.8844: UDP, length 1470
08:27:53.490863 IP 10.1.1.1.41027 > 8.8.4.4.8844: UDP, length 1470
08:27:53.502024 IP 10.1.1.1.41027 > 8.8.4.4.8844: UDP, length 1470
08:27:53.513224 IP 10.1.1.1.41027 > 8.8.4.4.8844: UDP, length 1470
08:27:53.524462 IP 10.1.1.1.41027 > 8.8.4.4.8844: UDP, length 1470
08:27:53.535743 IP 10.1.1.1.41027 > 8.8.4.4.8844: UDP, length 1470
08:27:53.546846 IP 10.1.1.1.41027 > 8.8.4.4.8844: UDP, length 1470
08:27:53.558154 IP 10.1.1.1.41027 > 8.8.4.4.8844: UDP, length 1470
08:27:53.569395 IP 10.1.1.1.41027 > 8.8.4.4.8844: UDP, length 1470
08:27:53.580556 IP 10.1.1.1.41027 > 8.8.4.4.8844: UDP, length 1470
08:27:53.591746 IP 10.1.1.1.41027 > 8.8.4.4.8844: UDP, length 1470
08:27:53.602943 IP 10.1.1.1.41027 > 8.8.4.4.8844: UDP, length 1470
08:27:53.614329 IP 10.1.1.1.41027 > 8.8.4.4.8844: UDP, length 1470
08:27:53.625403 IP 10.1.1.1.41027 > 8.8.4.4.8844: UDP, length 1470
08:27:53.636554 IP 10.1.1.1.41027 > 8.8.4.4.8844: UDP, length 1470
08:27:53.647771 IP 10.1.1.1.41027 > 8.8.4.4.8844: UDP, length 1470
08:27:53.659107 IP 10.1.1.1.41027 > 8.8.4.4.8844: UDP, length 1470
08:27:53.670217 IP 10.1.1.1.41027 > 8.8.4.4.8844: UDP, length 1470
08:27:53.681570 IP 10.1.1.1.41027 > 8.8.4.4.8844: UDP, length 1470
08:27:53.692634 IP 10.1.1.1.41027 > 8.8.4.4.8844: UDP, length 1470
08:27:53.703850 IP 10.1.1.1.41027 > 8.8.4.4.8844: UDP, length 1470
08:27:53.715239 IP 10.1.1.1.41027 > 8.8.4.4.8844: UDP, length 1470
08:27:53.726375 IP 10.1.1.1.41027 > 8.8.4.4.8844: UDP, length 1470
08:27:53.737540 IP 10.1.1.1.41027 > 8.8.4.4.8844: UDP, length 1470
08:27:53.748741 IP 10.1.1.1.41027 > 8.8.4.4.8844: UDP, length 1470
08:27:53.759918 IP 10.1.1.1.41027 > 8.8.4.4.8844: UDP, length 1470
08:27:53.771181 IP 10.1.1.1.41027 > 8.8.4.4.8844: UDP, length 1470
08:27:53.782542 IP 10.1.1.1.41027 > 8.8.4.4.8844: UDP, length 1470
08:27:53.793571 IP 10.1.1.1.41027 > 8.8.4.4.8844: UDP, length 1470
08:27:53.804784 IP 10.1.1.1.41027 > 8.8.4.4.8844: UDP, length 1470
08:27:53.816011 IP 10.1.1.1.41027 > 8.8.4.4.8844: UDP, length 1470
08:27:53.827257 IP 10.1.1.1.41027 > 8.8.4.4.8844: UDP, length 1470
08:27:53.838552 IP 10.1.1.1.41027 > 8.8.4.4.8844: UDP, length 1470
08:27:53.849840 IP 10.1.1.1.41027 > 8.8.4.4.8844: UDP, length 1470
08:27:53.860992 IP 10.1.1.1.41027 > 8.8.4.4.8844: UDP, length 1470
08:27:53.872144 IP 10.1.1.1.41027 > 8.8.4.4.8844: UDP, length 1470
08:27:53.883391 IP 10.1.1.1.41027 > 8.8.4.4.8844: UDP, length 1470
08:27:53.894547 IP 10.1.1.1.41027 > 8.8.4.4.8844: UDP, length 1470
08:27:53.905836 IP 10.1.1.1.41027 > 8.8.4.4.8844: UDP, length 1470
08:27:53.917021 IP 10.1.1.1.41027 > 8.8.4.4.8844: UDP, length 1470
08:27:53.928279 IP 10.1.1.1.41027 > 8.8.4.4.8844: UDP, length 1470
08:27:53.939526 IP 10.1.1.1.41027 > 8.8.4.4.8844: UDP, length 1470
08:27:53.950722 IP 10.1.1.1.41027 > 8.8.4.4.8844: UDP, length 1470
08:27:53.961849 IP 10.1.1.1.41027 > 8.8.4.4.8844: UDP, length 1470
08:27:53.973154 IP 10.1.1.1.41027 > 8.8.4.4.8844: UDP, length 1470
08:27:53.984322 IP 10.1.1.1.41027 > 8.8.4.4.8844: UDP, length 1470
08:27:53.995551 IP 10.1.1.1.41027 > 8.8.4.4.8844: UDP, length 1470
08:27:54.006962 IP 10.1.1.1.41027 > 8.8.4.4.8844: UDP, length 1470
08:27:54.018017 IP 10.1.1.1.41027 > 8.8.4.4.8844: UDP, length 1470
08:27:54.029151 IP 10.1.1.1.41027 > 8.8.4.4.8844: UDP, length 1470
08:27:54.040426 IP 10.1.1.1.41027 > 8.8.4.4.8844: UDP, length 1470
08:27:54.051690 IP 10.1.1.1.41027 > 8.8.4.4.8844: UDP, length 1470
08:27:54.062924 IP 10.1.1.1.41027 > 8.8.4.4.8844: UDP, length 1470
08:27:54.074073 IP 10.1.1.1.41027 > 8.8.4.4.8844: UDP, length 1470
08:27:54.085201 IP 10.1.1.1.41027 > 8.8.4.4.8844: UDP, length 1470
08:27:54.096494 IP 10.1.1.1.41027 > 8.8.4.4.8844: UDP, length 1470
08:27:54.107705 IP 10.1.1.1.41027 > 8.8.4.4.8844: UDP, length 1470
08:27:54.118929 IP 10.1.1.1.41027 > 8.8.4.4.8844: UDP, length 1470
08:27:54.130226 IP 10.1.1.1.41027 > 8.8.4.4.8844: UDP, length 1470
08:27:54.141370 IP 10.1.1.1.41027 > 8.8.4.4.8844: UDP, length 1470
08:27:54.152653 IP 10.1.1.1.41027 > 8.8.4.4.8844: UDP, length 1470
08:27:54.163780 IP 10.1.1.1.41027 > 8.8.4.4.8844: UDP, length 1470
08:27:54.175029 IP 10.1.1.1.41027 > 8.8.4.4.8844: UDP, length 1470
08:27:54.186159 IP 10.1.1.1.41027 > 8.8.4.4.8844: UDP, length 1470
08:27:54.197391 IP 10.1.1.1.41027 > 8.8.4.4.8844: UDP, length 1470
08:27:54.208637 IP 10.1.1.1.41027 > 8.8.4.4.8844: UDP, length 1470
08:27:54.219805 IP 10.1.1.1.41027 > 8.8.4.4.8844: UDP, length 1470
08:27:54.231070 IP 10.1.1.1.41027 > 8.8.4.4.8844: UDP, length 1470
08:27:54.242333 IP 10.1.1.1.41027 > 8.8.4.4.8844: UDP, length 1470
08:27:54.253561 IP 10.1.1.1.41027 > 8.8.4.4.8844: UDP, length 1470
08:27:54.264771 IP 10.1.1.1.41027 > 8.8.4.4.8844: UDP, length 1470
08:27:54.276022 IP 10.1.1.1.41027 > 8.8.4.4.8844: UDP, length 1470
08:27:54.287249 IP 10.1.1.1.41027 > 8.8.4.4.8844: UDP, length 1470
08:27:54.298466 IP 10.1.1.1.41027 > 8.8.4.4.8844: UDP, length 1470
08:27:54.309576 IP 10.1.1.1.41027 > 8.8.4.4.8844: UDP, length 1470
08:27:54.320878 IP 10.1.1.1.41027 > 8.8.4.4.8844: UDP, length 1470
08:27:54.332068 IP 10.1.1.1.41027 > 8.8.4.4.8844: UDP, length 1470
08:27:54.343300 IP 10.1.1.1.41027 > 8.8.4.4.8844: UDP, length 1470
08:27:54.354525 IP 10.1.1.1.41027 > 8.8.4.4.8844: UDP, length 1470
08:27:54.365641 IP 10.1.1.1.41027 > 8.8.4.4.8844: UDP, length 1470
08:27:54.376901 IP 10.1.1.1.41027 > 8.8.4.4.8844: UDP, length 1470
08:27:54.388058 IP 10.1.1.1.41027 > 8.8.4.4.8844: UDP, length 1470
08:27:54.399349 IP 10.1.1.1.41027 > 8.8.4.4.8844: UDP, length 1470
08:27:54.410557 IP 10.1.1.1.41027 > 8.8.4.4.8844: UDP, length 1470
08:27:54.421722 IP 10.1.1.1.41027 > 8.8.4.4.8844: UDP, length 1470
08:27:54.433007 IP 10.1.1.1.41027 > 8.8.4.4.8844: UDP, length 1470
08:27:54.444142 IP 10.1.1.1.41027 > 8.8.4.4.8844: UDP, length 1470
08:27:54.455429 IP 10.1.1.1.41027 > 8.8.4.4.8844: UDP, length 1470
08:27:54.466659 IP 10.1.1.1.41027 > 8.8.4.4.8844: UDP, length 1470
08:27:54.477838 IP 10.1.1.1.41027 > 8.8.4.4.8844: UDP, length 1470
08:27:54.489143 IP 10.1.1.1.41027 > 8.8.4.4.8844: UDP, length 1470
08:27:54.500258 IP 10.1.1.1.41027 > 8.8.4.4.8844: UDP, length 1470
08:27:54.511544 IP 10.1.1.1.41027 > 8.8.4.4.8844: UDP, length 1470
08:27:54.522847 IP 10.1.1.1.41027 > 8.8.4.4.8844: UDP, length 1470
08:27:54.534035 IP 10.1.1.1.41027 > 8.8.4.4.8844: UDP, length 1470
08:27:54.545089 IP 10.1.1.1.41027 > 8.8.4.4.8844: UDP, length 1470
08:27:54.556283 IP 10.1.1.1.41027 > 8.8.4.4.8844: UDP, length 1470
08:27:54.567624 IP 10.1.1.1.41027 > 8.8.4.4.8844: UDP, length 1470
08:27:54.578854 IP 10.1.1.1.41027 > 8.8.4.4.8844: UDP, length 1470
08:27:54.590039 IP 10.1.1.1.41027 > 8.8.4.4.8844: UDP, length 1470
08:27:54.601253 IP 10.1.1.1.41027 > 8.8.4.4.8844: UDP, length 1470
08:27:54.612341 IP 10.1.1.1.41027 > 8.8.4.4.8844: UDP, length 1470
08:27:54.623714 IP 10.1.1.1.41027 > 8.8.4.4.8844: UDP, length 1470
08:27:54.634827 IP 10.1.1.1.41027 > 8.8.4.4.8844: UDP, length 1470
08:27:54.646032 IP 10.1.1.1.41027 > 8.8.4.4.8844: UDP, length 1470
08:27:54.657232 IP 10.1.1.1.41027 > 8.8.4.4.8844: UDP, length 1470
08:27:54.668467 IP 10.1.1.1.41027 > 8.8.4.4.8844: UDP, length 1470
08:27:54.679678 IP 10.1.1.1.41027 > 8.8.4.4.8844: UDP, length 1470
08:27:54.690920 IP 10.1.1.1.41027 > 8.8.4.4.8844: UDP, length 1470
08:27:54.702201 IP 10.1.1.1.41027 > 8.8.4.4.8844: UDP, length 1470
08:27:54.713360 IP 10.1.1.1.41027 > 8.8.4.4.8844: UDP, length 1470
08:27:54.724571 IP 10.1.1.1.41027 > 8.8.4.4.8844: UDP, length 1470
08:27:54.735788 IP 10.1.1.1.41027 > 8.8.4.4.8844: UDP, length 1470
08:27:54.747102 IP 10.1.1.1.41027 > 8.8.4.4.8844: UDP, length 1470
08:27:54.758297 IP 10.1.1.1.41027 > 8.8.4.4.8844: UDP, length 1470
08:27:54.769535 IP 10.1.1.1.41027 > 8.8.4.4.8844: UDP, length 1470
08:27:54.780727 IP 10.1.1.1.41027 > 8.8.4.4.8844: UDP, length 1470
08:27:54.791857 IP 10.1.1.1.41027 > 8.8.4.4.8844: UDP, length 1470
08:27:54.803139 IP 10.1.1.1.41027 > 8.8.4.4.8844: UDP, length 1470
08:27:54.814462 IP 10.1.1.1.41027 > 8.8.4.4.8844: UDP, length 1470
08:27:54.825548 IP 10.1.1.1.41027 > 8.8.4.4.8844: UDP, length 1470
08:27:54.836870 IP 10.1.1.1.41027 > 8.8.4.4.8844: UDP, length 1470
08:27:54.847973 IP 10.1.1.1.41027 > 8.8.4.4.8844: UDP, length 1470
08:27:54.859246 IP 10.1.1.1.41027 > 8.8.4.4.8844: UDP, length 1470
08:27:54.870495 IP 10.1.1.1.41027 > 8.8.4.4.8844: UDP, length 1470
08:27:54.881594 IP 10.1.1.1.41027 > 8.8.4.4.8844: UDP, length 1470
08:27:54.892803 IP 10.1.1.1.41027 > 8.8.4.4.8844: UDP, length 1470
08:27:54.903978 IP 10.1.1.1.41027 > 8.8.4.4.8844: UDP, length 1470
08:27:54.915314 IP 10.1.1.1.41027 > 8.8.4.4.8844: UDP, length 1470
08:27:54.926426 IP 10.1.1.1.41027 > 8.8.4.4.8844: UDP, length 1470
08:27:54.937760 IP 10.1.1.1.41027 > 8.8.4.4.8844: UDP, length 1470
08:27:54.948975 IP 10.1.1.1.41027 > 8.8.4.4.8844: UDP, length 1470
08:27:54.960113 IP 10.1.1.1.41027 > 8.8.4.4.8844: UDP, length 1470
08:27:54.971506 IP 10.1.1.1.41027 > 8.8.4.4.8844: UDP, length 1470
08:27:54.982577 IP 10.1.1.1.41027 > 8.8.4.4.8844: UDP, length 1470
08:27:54.993758 IP 10.1.1.1.41027 > 8.8.4.4.8844: UDP, length 1470
08:27:55.004952 IP 10.1.1.1.41027 > 8.8.4.4.8844: UDP, length 1470
08:27:55.016180 IP 10.1.1.1.41027 > 8.8.4.4.8844: UDP, length 1470
08:27:55.027456 IP 10.1.1.1.41027 > 8.8.4.4.8844: UDP, length 1470
08:27:55.038676 IP 10.1.1.1.41027 > 8.8.4.4.8844: UDP, length 1470
08:27:55.049934 IP 10.1.1.1.41027 > 8.8.4.4.8844: UDP, length 1470
08:27:55.061174 IP 10.1.1.1.41027 > 8.8.4.4.8844: UDP, length 1470
08:27:55.072533 IP 10.1.1.1.41027 > 8.8.4.4.8844: UDP, length 1470
08:27:55.323013 IP 10.1.1.1.41027 > 8.8.4.4.8844: UDP, length 1470
08:27:55.573518 IP 10.1.1.1.41027 > 8.8.4.4.8844: UDP, length 1470
08:27:55.823845 IP 10.1.1.1.41027 > 8.8.4.4.8844: UDP, length 1470
08:27:56.074322 IP 10.1.1.1.41027 > 8.8.4.4.8844: UDP, length 1470
08:27:56.324628 IP 10.1.1.1.41027 > 8.8.4.4.8844: UDP, length 1470
08:27:56.574964 IP 10.1.1.1.41027 > 8.8.4.4.8844: UDP, length 1470
08:27:56.825390 IP 10.1.1.1.41027 > 8.8.4.4.8844: UDP, length 1470
08:27:57.075774 IP 10.1.1.1.41027 > 8.8.4.4.8844: UDP, length 1470
08:27:57.326212 IP 10.1.1.1.41027 > 8.8.4.4.8844: UDP, length 1470
^C
902 packets captured
902 packets received by filter
0 packets dropped by kernel
root@raul-Dell-G15-5520:/home/raul/documents/workspace/router-filtering-mininet
# clear
[H[Jroot@raul-Dell-G15-5520:/home/raul/documents/workspace/router-filtering-mininet
# 